Cites,Authors,Title,Year,Source,Publisher,ArticleURL,CitesURL,GSRank,QueryDate,Type,DOI,ISSN,CitationURL,Volume,Issue,StartPage,EndPage,ECC
62,"U Özdemir, B Özbay, S Veli, S Zor","Modeling adsorption of sodium dodecyl benzene sulfonate (SDBS) onto polyaniline (PANI) by using multi linear regression and artificial neural networks",2011,"Chemical Engineering Journal","Elsevier","http://www.sciencedirect.com/science/article/pii/S138589471101285X","https://scholar.google.com/scholar?cites=4498453045692341559&as_sdt=5,33&sciodt=0,33&hl=en&num=20",689,"2017-06-15","","","","",0,0,0,0,62
62,"R Noori, A Khakpour, B Omidvar, A Farokhnia","Comparison of ANN and principal component analysis-multivariate linear regression models for predicting the river flow based on developed discrepancy ratio statistic",2010,"Expert Systems with …","Elsevier","http://www.sciencedirect.com/science/article/pii/S095741741000059X","https://scholar.google.com/scholar?cites=3676171575828689524&as_sdt=5,33&sciodt=0,33&hl=en&num=20",690,"2017-06-15","","","","",0,0,0,0,62
61,"FN Gellerich, WS Kunz, R Bohnensack","Estimation of flux control coefficients from inhibitor titrations by non-linear regression",1990,"FEBS letters","Elsevier","http://www.sciencedirect.com/science/article/pii/001457939081355R","https://scholar.google.com/scholar?cites=1456735995918776479&as_sdt=5,33&sciodt=0,33&hl=en&num=20",509,"2017-06-15","HTML","","","",0,0,0,0,61
61,"GO Ewing","Gravity and linear regression models of spatial interaction: a cautionary note",1974,"Economic Geography","Taylor & Francis","http://www.tandfonline.com/doi/pdf/10.2307/143008","https://scholar.google.com/scholar?cites=5454191033797172822&as_sdt=5,33&sciodt=0,33&hl=en&num=20",546,"2017-06-15","","","","",0,0,0,0,61
61,"MH Hubert, P Wijekoon","Improvement of the Liu estimator in linear regression model",2006,"Statistical Papers","Springer","http://link.springer.com/article/10.1007/s00362-006-0300-4","https://scholar.google.com/scholar?cites=1546303269512267116&as_sdt=5,33&sciodt=0,33&hl=en&num=20",555,"2017-06-15","","","","",0,0,0,0,61
61,"G Qin, BY Jing","Empirical likelihood for censored linear regression",2001,"Scandinavian Journal of Statistics","Wiley Online Library","http://onlinelibrary.wiley.com/doi/10.1111/1467-9469.00261/full","https://scholar.google.com/scholar?cites=17198534609060787055&as_sdt=5,33&sciodt=0,33&hl=en&num=20",564,"2017-06-15","","","","",0,0,0,0,61
61,"P Högberg","Estimation of parameters in models for traffic prediction: a non-linear regression approach",1976,"Transportation Research","Elsevier","http://www.sciencedirect.com/science/article/pii/0041164776900599","https://scholar.google.com/scholar?cites=13200251258898903966&as_sdt=5,33&sciodt=0,33&hl=en&num=20",615,"2017-06-15","","","","",0,0,0,0,61
61,"W Liu, M Jamshidian, Y Zhang","Multiple comparison of several linear regression models",2004,"Journal of the American …","amstat.tandfonline.com","http://amstat.tandfonline.com/doi/abs/10.1198/016214504000000395","https://scholar.google.com/scholar?cites=15034195442682664005&as_sdt=5,33&sciodt=0,33&hl=en&num=20",650,"2017-06-15","","","","",0,0,0,0,61
61,"JH Ward Jr","Multiple linear regression models",1962,"Computer applications in the …","Prentice-Hall Englewood Cliffs, New …","","https://scholar.google.com/scholar?cites=4897601772789461404&as_sdt=5,33&sciodt=0,33&hl=en&num=20",738,"2017-06-15","CITATION","","","",0,0,0,0,61
61,"L Wang","The L1 penalized LAD estimator for high dimensional linear regression",2013,"Journal of Multivariate Analysis","Elsevier","http://www.sciencedirect.com/science/article/pii/S0047259X1300047X","https://scholar.google.com/scholar?cites=16060532507730873391&as_sdt=5,33&sciodt=0,33&hl=en&num=20",758,"2017-06-15","","","","",0,0,0,0,61
61,"R Essery, J Pomeroy, C Ellis, T Link","Modelling longwave radiation to snow beneath forest canopies using hemispherical photography or linear regression",2008,"Hydrological processes","Wiley Online Library","http://onlinelibrary.wiley.com/doi/10.1002/hyp.6930/full","https://scholar.google.com/scholar?cites=4806328563810690808&as_sdt=5,33&sciodt=0,33&hl=en&num=20",767,"2017-06-15","","","","",0,0,0,0,61
61,"GL Shi, X Li, YC Feng, YQ Wang, JH Wu, J Li…","… apportionment, using positive matrix factorization–chemical mass balance and principal component analysis/multiple linear regression–chemical mass balance …",2009,"Atmospheric …","Elsevier","http://www.sciencedirect.com/science/article/pii/S1352231009001848","https://scholar.google.com/scholar?cites=894306951464216390&as_sdt=5,33&sciodt=0,33&hl=en&num=20",900,"2017-06-15","","","","",0,0,0,0,61
60,"MS Yang, HH Liu","Fuzzy least-squares algorithms for interactive fuzzy linear regression models",2003,"Fuzzy Sets and systems","Elsevier","http://www.sciencedirect.com/science/article/pii/S0165011402001239","https://scholar.google.com/scholar?cites=1199117229500654502&as_sdt=5,33&sciodt=0,33&hl=en&num=20",365,"2017-06-15","","","","",0,0,0,0,60
60,"BD Baker, CE Richards","A comparison of conventional linear regression methods and neural networks for forecasting educational spending",1999,"Economics of Education Review","Elsevier","http://www.sciencedirect.com/science/article/pii/S0272775799000035","https://scholar.google.com/scholar?cites=11606114940326542485&as_sdt=5,33&sciodt=0,33&hl=en&num=20",630,"2017-06-15","","","","",0,0,0,0,60
60,"CM Norris, WA Ghali, LD Saunders, R Brant…","Ordinal regression model and the linear regression model were superior to the logistic regression models",2006,"Journal of clinical …","Elsevier","http://www.sciencedirect.com/science/article/pii/S0895435605003537","https://scholar.google.com/scholar?cites=504640533154378833&as_sdt=5,33&sciodt=0,33&hl=en&num=20",652,"2017-06-15","","","","",0,0,0,0,60
60,"ötz Trenkler","Mean square error matrix comparisons of estimators in linear regression",1985,"Communications in Statistics-Theory and Methods","Taylor & Francis","http://www.tandfonline.com/doi/abs/10.1080/03610928508829058","https://scholar.google.com/scholar?cites=4031486509725303207&as_sdt=5,33&sciodt=0,33&hl=en&num=20",655,"2017-06-15","","","","",0,0,0,0,60
60,"WF Reynolds, A Gomes, A Maron…","… 4-substituted styrenes: definition of substituent constants and determination of mechanisms of transmission of substituent effects by iterative multiple linear regression",1983,"Canadian journal of …","NRC Research Press","http://www.nrcresearchpress.com/doi/abs/10.1139/v83-412","https://scholar.google.com/scholar?cites=858843993480137910&as_sdt=5,33&sciodt=0,33&hl=en&num=20",680,"2017-06-15","","","","",0,0,0,0,60
60,"NR Draper, H Smith","Applied linear regression",1966,"… a very complete treatment of regression see John Wiley …","","","https://scholar.google.com/scholar?cites=1888296735437035609&as_sdt=5,33&sciodt=0,33&hl=en&num=20",759,"2017-06-15","CITATION","","","",0,0,0,0,60
59,"M Moeur","Crown width and foliage weight of northern Rocky Mountain conifers [multiple linear regression models, Pseudotsuga, Picea, Abies, Pinus, Larix, Thuja, …",1981,"USDA Forest Service Research Paper INT (USA)","agris.fao.org","http://agris.fao.org/agris-search/search.do?recordID=US8130163","https://scholar.google.com/scholar?cites=5316745017303080837&as_sdt=5,33&sciodt=0,33&hl=en&num=20",613,"2017-06-15","CITATION","","","",0,0,0,0,59
59,"CA Glasbey","Correlated residuals in non-linear regression applied to growth data",1979,"Applied Statistics","JSTOR","http://www.jstor.org/stable/2347195","https://scholar.google.com/scholar?cites=11739576568826216375&as_sdt=5,33&sciodt=0,33&hl=en&num=20",634,"2017-06-15","","","","",0,0,0,0,59
59,"LG Doray","UMVUE of the IBNR reserve in a lognormal linear regression model",1996,"Insurance: Mathematics and Economics","Elsevier","http://www.sciencedirect.com/science/article/pii/0167668795000275","https://scholar.google.com/scholar?cites=14188497753938471760&as_sdt=5,33&sciodt=0,33&hl=en&num=20",636,"2017-06-15","","","","",0,0,0,0,59
59,"SP Ellis","Instability of least squares, least absolute deviation and least median of squares linear regression",1998,"Statistical Science","JSTOR","http://www.jstor.org/stable/2676815","https://scholar.google.com/scholar?cites=9542149927685917573&as_sdt=5,33&sciodt=0,33&hl=en&num=20",643,"2017-06-15","","","","",0,0,0,0,59
59,"KV Kumar, K Porkodi, F Rocha","Comparison of various error functions in predicting the optimum isotherm by linear and non-linear regression analysis for the sorption of basic red 9 by activated …",2008,"Journal of hazardous materials","Elsevier","http://www.sciencedirect.com/science/article/pii/S0304389407013076","https://scholar.google.com/scholar?cites=7495184831212290035&as_sdt=5,33&sciodt=0,33&hl=en&num=20",648,"2017-06-15","","","","",0,0,0,0,59
59,"L Pesotchinsky","Optimal robust designs: linear regression in Rk",1982,"The Annals of Statistics","JSTOR","http://www.jstor.org/stable/2240685","https://scholar.google.com/scholar?cites=349738418435029076&as_sdt=5,33&sciodt=0,33&hl=en&num=20",681,"2017-06-15","","","","",0,0,0,0,59
59,"MF Desrosiers, GL Wilson, CR Hunter…","Estimation of the absorbed dose in radiation-processed food—1. Test of the EPR response function by a linear regression analysis",1991,"International journal of …","Elsevier","http://www.sciencedirect.com/science/article/pii/0883288991900305","https://scholar.google.com/scholar?cites=17274277513070031913&as_sdt=5,33&sciodt=0,33&hl=en&num=20",693,"2017-06-15","","","","",0,0,0,0,59
58,"E Giles, LL Klepinger","Confidence intervals for estimates based on linear regression in forensic anthropology",1988,"Journal of Forensic Science","astm.org","http://www.astm.org/DIGITAL_LIBRARY/JOURNALS/FORENSIC/PAGES/JFS12555J.htm","https://scholar.google.com/scholar?cites=639931962783099072&as_sdt=5,33&sciodt=0,33&hl=en&num=20",484,"2017-06-15","","","","",0,0,0,0,58
58,"Z Ibrahim, D Rusli","Predicting students' academic performance: comparing artificial neural network, decision tree and linear regression",2007,"21st Annual SAS Malaysia Forum","researchgate.net","https://www.researchgate.net/profile/Daliela_Rusli/publication/228894873_Predicting_Students'_Academic_Performance_Comparing_Artificial_Neural_Network_Decision_Tree_and_Linear_Regression/links/0deec51bb04e76ed93000000.pdf","https://scholar.google.com/scholar?cites=9330378175403363918&as_sdt=5,33&sciodt=0,33&hl=en&num=20",549,"2017-06-15","PDF","","","",0,0,0,0,58
58,"LG Godfrey, JP Hutton","Discriminating between errors-in-variables/simultaneity and misspecification in linear regression models",1994,"Economics Letters","Elsevier","http://www.sciencedirect.com/science/article/pii/0165176594901031","https://scholar.google.com/scholar?cites=16054176097257829938&as_sdt=5,33&sciodt=0,33&hl=en&num=20",573,"2017-06-15","","","","",0,0,0,0,58
58,"AM Nevill, RL Holder","Modelling maximum oxygen uptake-a case-study in non-linear regression model formulation and comparison",1994,"Applied Statistics","JSTOR","http://www.jstor.org/stable/2986263","https://scholar.google.com/scholar?cites=5331489781470429615&as_sdt=5,33&sciodt=0,33&hl=en&num=20",638,"2017-06-15","","","","",0,0,0,0,58
58,"A Keszler, B Kalyanaraman, N Hogg","Comparative investigation of superoxide trapping by cyclic nitrone spin traps: the use of singular value decomposition and multiple linear regression analysis",2003,"Free Radical Biology and Medicine","Elsevier","http://www.sciencedirect.com/science/article/pii/S0891584903004970","https://scholar.google.com/scholar?cites=7005537445905068099&as_sdt=5,33&sciodt=0,33&hl=en&num=20",642,"2017-06-15","","","","",0,0,0,0,58
58,"C Brasquet, B Bourges, P Le Cloirec","… property relationship (QSPR) for the adsorption of organic compounds onto activated carbon cloth: Comparison between multiple linear regression and neural network",1999,"Environmental science & …","ACS Publications","http://pubs.acs.org/doi/abs/10.1021/es981358m","https://scholar.google.com/scholar?cites=3672918261534682255&as_sdt=5,33&sciodt=0,33&hl=en&num=20",729,"2017-06-15","","","","",0,0,0,0,58
58,"SN Lahiri","On Edgeworth Expansion and Moving Block Bootstrap for StudentizedM-Estimators in Multiple Linear Regression Models",1996,"Journal of Multivariate Analysis","Elsevier","http://www.sciencedirect.com/science/article/pii/S0047259X96900032","https://scholar.google.com/scholar?cites=1047769203410856593&as_sdt=5,33&sciodt=0,33&hl=en&num=20",810,"2017-06-15","","","","",0,0,0,0,58
58,"A Giacomino, O Abollino, M Malandrino…","The role of chemometrics in single and sequential extraction assays: a review. Part II. Cluster analysis, multiple linear regression, mixture resolution, experimental …",2011,"Analytica Chimica Acta","Elsevier","http://www.sciencedirect.com/science/article/pii/S0003267010015977","https://scholar.google.com/scholar?cites=12073003775284985249&as_sdt=5,33&sciodt=0,33&hl=en&num=20",943,"2017-06-15","","","","",0,0,0,0,58
57,"K Hoffmann","Characterization of minimax linear estimators in linear regression",1979,"Statistics: A Journal of Theoretical and Applied …","Taylor & Francis","http://www.tandfonline.com/doi/abs/10.1080/02331887908801463","https://scholar.google.com/scholar?cites=9495400847728733437&as_sdt=5,33&sciodt=0,33&hl=en&num=20",456,"2017-06-15","","","","",0,0,0,0,57
57,"S Chatterjee, AS Hadi","Simple linear regression",2006,"Regression Analysis by Example, …","Wiley Online Library","http://onlinelibrary.wiley.com/doi/10.1002/0470055464.ch2/summary","https://scholar.google.com/scholar?cites=15063367677797155311&as_sdt=5,33&sciodt=0,33&hl=en&num=20",497,"2017-06-15","","","","",0,0,0,0,57
57,"EI Canela","A free derivate program for non-linear regression analysis of enzyme kinetics to be used on small computers",1984,"International journal of bio-medical computing","Elsevier","http://www.sciencedirect.com/science/article/pii/0020710184900242","https://scholar.google.com/scholar?cites=7961018103115911294&as_sdt=5,33&sciodt=0,33&hl=en&num=20",612,"2017-06-15","","","","",0,0,0,0,57
57,"J Tolvi","Genetic algorithms for outlier detection and variable selection in linear regression models",2004,"Soft Computing-A Fusion of Foundations, …","Springer","http://www.springerlink.com/index/4U1RU1N3R4EX0993.pdf","https://scholar.google.com/scholar?cites=6714346034313849777&as_sdt=5,33&sciodt=0,33&hl=en&num=20",665,"2017-06-15","","","","",0,0,0,0,57
57,"B Wu","Differential gene expression detection using penalized linear regression models: the improved SAM statistics",2004,"Bioinformatics","academic.oup.com","https://academic.oup.com/bioinformatics/article-abstract/21/8/1565/250561","https://scholar.google.com/scholar?cites=4568959044602416748&as_sdt=5,33&sciodt=0,33&hl=en&num=20",667,"2017-06-15","","","","",0,0,0,0,57
57,"RD Cook","Detection of influential observation in linear regression",2000,"Technometrics","Taylor & Francis","http://www.tandfonline.com/doi/abs/10.1080/00401706.2000.10485981","https://scholar.google.com/scholar?cites=11766904178273219265&as_sdt=5,33&sciodt=0,33&hl=en&num=20",673,"2017-06-15","","","","",0,0,0,0,57
57,"NM Najafi, AS Hamid, RK Afshin","Determination of caffeine in black tea leaves by Fourier transform infrared spectrometry using multiple linear regression",2003,"Microchemical Journal","Elsevier","http://www.sciencedirect.com/science/article/pii/S0026265X0300095X","https://scholar.google.com/scholar?cites=5517697001235748838&as_sdt=5,33&sciodt=0,33&hl=en&num=20",679,"2017-06-15","","","","",0,0,0,0,57
57,"M Eyvazian, R Noorossana…","Phase II monitoring of multivariate multiple linear regression profiles",2011,"Quality and Reliability …","Wiley Online Library","http://onlinelibrary.wiley.com/doi/10.1002/qre.1119/full","https://scholar.google.com/scholar?cites=13703768175751946767&as_sdt=5,33&sciodt=0,33&hl=en&num=20",698,"2017-06-15","","","","",0,0,0,0,57
57,"L Mili, CW Coakley","Robust estimation in structured linear regression",1996,"The Annals of Statistics","projecteuclid.org","http://projecteuclid.org/euclid.aos/1032181171","https://scholar.google.com/scholar?cites=18118511659981027166&as_sdt=5,33&sciodt=0,33&hl=en&num=20",709,"2017-06-15","","","","",0,0,0,0,57
57,"AG González","Two level factorial experimental designs based on multiple linear regression models: a tutorial digest illustrated by case studies",1998,"Analytica Chimica Acta","Elsevier","http://www.sciencedirect.com/science/article/pii/S0003267097007010","https://scholar.google.com/scholar?cites=12785686942251794143&as_sdt=5,33&sciodt=0,33&hl=en&num=20",736,"2017-06-15","","","","",0,0,0,0,57
57,"J Wise","Linear estimators for linear regression systems having infinite residual variances",1966,"","University of Hawaii","","https://scholar.google.com/scholar?cites=14749578003495804473&as_sdt=5,33&sciodt=0,33&hl=en&num=20",751,"2017-06-15","CITATION","","","",0,0,0,0,57
57,"R Piloto-Rodríguez, Y Sánchez-Borroto…","Prediction of the cetane number of biodiesel using artificial neural networks and multiple linear regression",2013,"Energy Conversion and …","Elsevier","http://www.sciencedirect.com/science/article/pii/S0196890412003093","https://scholar.google.com/scholar?cites=3366088384033711938&as_sdt=5,33&sciodt=0,33&hl=en&num=20",772,"2017-06-15","","","","",0,0,0,0,57
57,"J Neter, W Wasserman, MG Kutner","Applied linear regression analysis",1989,"Homewood, IL: Irwin","","","https://scholar.google.com/scholar?cites=7960790858519368423&as_sdt=5,33&sciodt=0,33&hl=en&num=20",881,"2017-06-15","CITATION","","","",0,0,0,0,57
56,"SC Narula","Optimization techniques in linear regression: A review",1982,"TIMS Studies in the Management …","North Holland Publishing Co. …","","https://scholar.google.com/scholar?cites=6252747039351339044&as_sdt=5,33&sciodt=0,33&hl=en&num=20",489,"2017-06-15","CITATION","","","",0,0,0,0,56
56,"VMF de Lima, JP Pijn, CN Filipe, FL da Silva","The role of hippocampal commissures in the interhemispheric transfer of epileptiform afterdischarges in the rat: a study using linear and non-linear regression analysis",1990,"… and clinical neurophysiology","Elsevier","http://www.sciencedirect.com/science/article/pii/0013469490900033","https://scholar.google.com/scholar?cites=7733507926741984018&as_sdt=5,33&sciodt=0,33&hl=en&num=20",563,"2017-06-15","","","","",0,0,0,0,56
56,"RJ Oosterbaan, DP Sharma, KN Singh…","Crop production and soil salinity: evaluation of field data from India by segmented linear regression with breakpoint",1990,"Proceedings of the …","researchgate.net","https://www.researchgate.net/profile/Roland_Oosterbaan/publication/242687473_Crop_production_and_soil_salinity_Evaluation_of_field_data_from_India_by_segmented_linear_regression_with_breakpoint/links/55817e9a08ae6cf036c16743.pdf","https://scholar.google.com/scholar?cites=1848044832163146881&as_sdt=5,33&sciodt=0,33&hl=en&num=20",589,"2017-06-15","PDF","","","",0,0,0,0,56
56,"FL Mayer, GF Krause, MR Ellersieck…","Predicting chronic lethality of chemicals to fishes from acute toxicity test data: Concepts and linear regression analysis",1994,"Environmental …","Wiley Online Library","http://onlinelibrary.wiley.com/doi/10.1002/etc.5620130418/full","https://scholar.google.com/scholar?cites=5296997822831923683&as_sdt=5,33&sciodt=0,33&hl=en&num=20",662,"2017-06-15","","","","",0,0,0,0,56
56,"K Nouri-Mahdavi, J Caprioli, AL Coleman…","Pointwise linear regression for evaluation of visual field outcomes and comparison with the advanced glaucoma intervention study methods",2005,"Archives of …","jamanetwork.com","http://jamanetwork.com/journals/jamaophthalmology/fullarticle/416828","https://scholar.google.com/scholar?cites=16365609604948227827&as_sdt=5,33&sciodt=0,33&hl=en&num=20",670,"2017-06-15","HTML","","","",0,0,0,0,56
56,"JM Wild, N Hutchings, MK Hussey, JG Flanagan…","Pointwise univariate linear regression of perimetric sensitivity against follow-up time in glaucoma",1997,"Ophthalmology","Elsevier","http://www.sciencedirect.com/science/article/pii/S0161642097302292","https://scholar.google.com/scholar?cites=13981703567010402150&as_sdt=5,33&sciodt=0,33&hl=en&num=20",685,"2017-06-15","","","","",0,0,0,0,56
56,"G Heller, JS Simonoff","Prediction in censored survival data: a comparison of the proportional hazards and linear regression models",1992,"Biometrics","JSTOR","http://www.jstor.org/stable/2532742","https://scholar.google.com/scholar?cites=1639185507991497808&as_sdt=5,33&sciodt=0,33&hl=en&num=20",713,"2017-06-15","","","","",0,0,0,0,56
56,"ME Klein, DJ Dabbs, Y Shuai, AM Brufsky…","Prediction of the Oncotype DX recurrence score: use of pathology-generated equations derived by linear regression analysis",2013,"Modern …","nature.com","http://www.nature.com/modpathol/journal/vaop/ncurrent/full/modpathol201336a.html","https://scholar.google.com/scholar?cites=8927012307307159607&as_sdt=5,33&sciodt=0,33&hl=en&num=20",731,"2017-06-15","HTML","","","",0,0,0,0,56
56,"A Zellner","Linear regression with inequality constraints on the coefficients: An application of quadratic programming and linear decision rules",1961,"","","","https://scholar.google.com/scholar?cites=14211014374322116156&as_sdt=5,33&sciodt=0,33&hl=en&num=20",752,"2017-06-15","CITATION","","","",0,0,0,0,56
56,"PL Bartlett, S Mendelson, J Neeman","ℓ 1-regularized linear regression: persistence and oracle inequalities",2012,"Probability theory and related fields","Springer","http://www.springerlink.com/index/4HU86869M1H56581.pdf","https://scholar.google.com/scholar?cites=14034345320608914525&as_sdt=5,33&sciodt=0,33&hl=en&num=20",790,"2017-06-15","","","","",0,0,0,0,56
56,"R Shetty, BC Kelly, F Bigiel","Evidence for a non-universal Kennicutt–Schmidt relationship using hierarchical Bayesian linear regression",2013,"Monthly Notices of the Royal …","mnras.oxfordjournals.org","http://mnras.oxfordjournals.org/content/early/2013/01/17/mnras.sts617.short","https://scholar.google.com/scholar?cites=9252413456375643195&as_sdt=5,33&sciodt=0,33&hl=en&num=20",914,"2017-06-15","","","","",0,0,0,0,56
55,"AE Gelfand, DK Dey","Improved estimation of the disturbance variance in a linear regression model",1988,"Journal of Econometrics","Elsevier","http://www.sciencedirect.com/science/article/pii/0304407688900656","https://scholar.google.com/scholar?cites=6837045726947026579&as_sdt=5,33&sciodt=0,33&hl=en&num=20",596,"2017-06-15","","","","",0,0,0,0,55
55,"PM Robinson","Non-linear regression for multiple time-series",1972,"Journal of Applied Probability","Cambridge Univ Press","http://journals.cambridge.org/abstract_S0021900200036135","https://scholar.google.com/scholar?cites=12844917757183804730&as_sdt=5,33&sciodt=0,33&hl=en&num=20",622,"2017-06-15","","","","",0,0,0,0,55
55,"T Hong, P Wang, HL Willis","A naïve multiple linear regression benchmark for short term load forecasting",2011,"Power and Energy Society …","ieeexplore.ieee.org","http://ieeexplore.ieee.org/abstract/document/6038881/","https://scholar.google.com/scholar?cites=4582338072055617443&as_sdt=5,33&sciodt=0,33&hl=en&num=20",664,"2017-06-15","","","","",0,0,0,0,55
55,"E Uusipaikka","Exact confidence bands for linear regression over intervals",1983,"Journal of the American Statistical Association","Taylor & Francis","http://www.tandfonline.com/doi/abs/10.1080/01621459.1983.10478023","https://scholar.google.com/scholar?cites=689669887947495752&as_sdt=5,33&sciodt=0,33&hl=en&num=20",675,"2017-06-15","","","","",0,0,0,0,55
55,"D Kumar, U Westberg","Proportional hazards modeling of time-dependent covariates using linear regression: a case study [mine power cable reliability]",1996,"IEEE Transactions on Reliability","ieeexplore.ieee.org","http://ieeexplore.ieee.org/abstract/document/536990/","https://scholar.google.com/scholar?cites=8385743595507345087&as_sdt=5,33&sciodt=0,33&hl=en&num=20",688,"2017-06-15","","","","",0,0,0,0,55
55,"A Bianco, G Boente","Robust estimators in semiparametric partly linear regression models",2004,"Journal of Statistical Planning and Inference","Elsevier","http://www.sciencedirect.com/science/article/pii/S0378375803002398","https://scholar.google.com/scholar?cites=15162538043532016134&as_sdt=5,33&sciodt=0,33&hl=en&num=20",717,"2017-06-15","","","","",0,0,0,0,55
55,"P Budrugeac, E Segal","Application of isoconversional and multivariate non-linear regression methods for evaluation of the degradation mechanism and kinetic parameters of an epoxy resin",2008,"Polymer Degradation and Stability","Elsevier","http://www.sciencedirect.com/science/article/pii/S0141391008000943","https://scholar.google.com/scholar?cites=16579072564172316626&as_sdt=5,33&sciodt=0,33&hl=en&num=20",815,"2017-06-15","","","","",0,0,0,0,55
55,"O Seidou, TBMJ Ouarda","Recursion‐based multiple changepoint detection in multiple linear regression and application to river streamflows",2007,"Water Resources Research","Wiley Online Library","http://onlinelibrary.wiley.com/doi/10.1029/2006WR005021/full","https://scholar.google.com/scholar?cites=1560031577783206937&as_sdt=5,33&sciodt=0,33&hl=en&num=20",824,"2017-06-15","HTML","","","",0,0,0,0,55
55,"H Cardot, C Crambes, A Kneip, P Sarda","Smoothing splines estimators in functional linear regression with errors-in-variables",2007,"Computational statistics & data …","Elsevier","http://www.sciencedirect.com/science/article/pii/S0167947306002477","https://scholar.google.com/scholar?cites=14297440692706836620&as_sdt=5,33&sciodt=0,33&hl=en&num=20",831,"2017-06-15","","","","",0,0,0,0,55
55,"CA Hosman, BB Hansen, PW Holland","THE SENSITIVITY OF LINEAR REGRESSION COEFFICIENTS'CONFIDENCE LIMITS TO THE OMISSION OF A CONFOUNDER",2010,"The Annals of Applied Statistics","JSTOR","http://www.jstor.org/stable/29765533","https://scholar.google.com/scholar?cites=18403380110808741621&as_sdt=5,33&sciodt=0,33&hl=en&num=20",836,"2017-06-15","","","","",0,0,0,0,55
