Cites,Authors,Title,Year,Source,Publisher,ArticleURL,CitesURL,GSRank,QueryDate,Type,DOI,ISSN,CitationURL,Volume,Issue,StartPage,EndPage,ECC
510,"P Burton, L Gurrin, P Sly","Tutorial in biostatistics. Extending the simple linear regression model to account for correlated responses: an introduction to generalized estimating equations …",1998,"Statistics in medicine","researchgate.net","https://www.researchgate.net/profile/Peter_Sly/publication/13615356_Clustered_Data_Extending_the_Simple_Linear_Regression_Model_to_Account_for_Correlated_Responses_An_Introduction_to_Generalized_Estimating_Equations_and_Multi-Level_Mixed_Modelling/links/00b7d515b52c1ad7ad000000.pdf","https://scholar.google.com/scholar?cites=5077252181302451475&as_sdt=5,33&sciodt=0,33&hl=en&num=20",74,"2017-06-15","PDF","","","",0,0,0,0,510
510,"H Koul, V Susarla, J Van Ryzin","Regression analysis with randomly right-censored data",1981,"The Annals of Statistics","JSTOR","http://www.jstor.org/stable/2240417","https://scholar.google.com/scholar?cites=17680303178834866911&as_sdt=5,33&sciodt=0,33&hl=en&num=20",730,"2017-06-15","","","","",0,0,0,0,510
507,"OO Aalen","A linear regression model for the analysis of life times",1989,"Statistics in medicine","Wiley Online Library","http://onlinelibrary.wiley.com/doi/10.1002/sim.4780080803/full","https://scholar.google.com/scholar?cites=10017672899621475398&as_sdt=5,33&sciodt=0,33&hl=en&num=20",61,"2017-06-15","","","","",0,0,0,0,507
503,"RM Schoolfield, PJH Sharpe, CE Magnuson","Non-linear regression of biological temperature-dependent rate models based on absolute reaction-rate theory",1981,"Journal of theoretical biology","Elsevier","http://www.sciencedirect.com/science/article/pii/0022519381902460","https://scholar.google.com/scholar?cites=10652968970565152455&as_sdt=5,33&sciodt=0,33&hl=en&num=20",53,"2017-06-15","","","","",0,0,0,0,503
497,"G Elfving","Optimum allocation in linear regression theory",1952,"The Annals of Mathematical Statistics","projecteuclid.org","http://projecteuclid.org/euclid.aoms/1177729442","https://scholar.google.com/scholar?cites=16066640960377530783&as_sdt=5,33&sciodt=0,33&hl=en&num=20",47,"2017-06-15","","","","",0,0,0,0,497
496,"DW Hosmer, S Taber…","The importance of assessing the fit of logistic regression models: a case study.",1991,"American journal of …","ajph.aphapublications.org","http://ajph.aphapublications.org/doi/abs/10.2105/AJPH.81.12.1630","https://scholar.google.com/scholar?cites=6825728731136741449&as_sdt=5,33&sciodt=0,33&hl=en&num=20",458,"2017-06-15","","","","",0,0,0,0,496
481,"RM Royall","On finite population sampling theory under certain linear regression models",1970,"Biometrika","Biometrika Trust","http://biomet.oxfordjournals.org/content/57/2/377","https://scholar.google.com/scholar?cites=2653340095153547965&as_sdt=5,33&sciodt=0,33&hl=en&num=20",56,"2017-06-15","","","","",0,0,0,0,481
475,"WY Loh","Classification and regression trees",2011,"Wiley Interdisciplinary Reviews: Data Mining and …","Wiley Online Library","http://onlinelibrary.wiley.com/doi/10.1002/widm.8/full","https://scholar.google.com/scholar?cites=10035459209537612069&as_sdt=5,33&sciodt=0,33&hl=en&num=20",684,"2017-06-15","","","","",0,0,0,0,475
473,"H Tanaka, J Watada","Possibilistic linear systems and their application to the linear regression model",1988,"Fuzzy sets and systems","Elsevier","http://www.sciencedirect.com/science/article/pii/0165011488900541","https://scholar.google.com/scholar?cites=17603193969826789292&as_sdt=5,33&sciodt=0,33&hl=en&num=20",55,"2017-06-15","","","","",0,0,0,0,473
471,"KH Zou, K Tuncali, SG Silverman","Correlation and simple linear regression 1",2003,"Radiology","pubs.rsna.org","http://pubs.rsna.org/doi/abs/10.1148/radiol.2273011499","https://scholar.google.com/scholar?cites=6440636672703722857&as_sdt=5,33&sciodt=0,33&hl=en&num=20",59,"2017-06-15","","","","",0,0,0,0,471
463,"AF Siegel","Robust regression using repeated medians",1982,"Biometrika","JSTOR","http://www.jstor.org/stable/2335877","https://scholar.google.com/scholar?cites=5270157405815867185&as_sdt=5,33&sciodt=0,33&hl=en&num=20",186,"2017-06-15","","","","",0,0,0,0,463
459,"GL Raff, SA Glantz","Volume loading slows left ventricular isovolumic relaxation rate",1981,"Circulation Research","insights.ovid.com","http://insights.ovid.com/circulation-research/cres/1981/48/060/volume-loading-slows-left-ventricular-isovolumic/6/00003012","https://scholar.google.com/scholar?cites=4599364255481400766&as_sdt=5,33&sciodt=0,33&hl=en&num=20",531,"2017-06-15","","","","",0,0,0,0,459
448,"CE Rasmussen","Evaluation of Gaussian processes and other methods for non-linear regression",1996,"","Citeseer","","https://scholar.google.com/scholar?cites=6062532221784347053&as_sdt=5,33&sciodt=0,33&hl=en&num=20",114,"2017-06-15","CITATION","","","",0,0,0,0,448
448,"E García‐Berthou","On the misuse of residuals in ecology: testing regression residuals vs. the analysis of covariance",2001,"Journal of Animal Ecology","Wiley Online Library","http://onlinelibrary.wiley.com/doi/10.1046/j.1365-2656.2001.00524.x/full","https://scholar.google.com/scholar?cites=6849826210971592264&as_sdt=5,33&sciodt=0,33&hl=en&num=20",478,"2017-06-15","HTML","","","",0,0,0,0,448
444,"CH Achen","Social psychology, demographic variables, and linear regression: Breaking the iron triangle in voting research",1992,"Political behavior","Springer","http://www.springerlink.com/index/Q400592V8451G25H.pdf","https://scholar.google.com/scholar?cites=2405275360256207779&as_sdt=5,33&sciodt=0,33&hl=en&num=20",65,"2017-06-15","","","","",0,0,0,0,444
444,"AA Tsiatis","Estimating regression parameters using linear rank tests for censored data",1990,"The Annals of Statistics","JSTOR","http://www.jstor.org/stable/2241547","https://scholar.google.com/scholar?cites=18173711327817522586&as_sdt=5,33&sciodt=0,33&hl=en&num=20",68,"2017-06-15","","","","",0,0,0,0,444
443,"C Gourieroux, A Holly, A Monfort","Likelihood ratio test, Wald test, and Kuhn-Tucker test in linear models with inequality constraints on the regression parameters",1982,"Econometrica: journal of the Econometric …","JSTOR","http://www.jstor.org/stable/1912529","https://scholar.google.com/scholar?cites=8119581242157532990&as_sdt=5,33&sciodt=0,33&hl=en&num=20",67,"2017-06-15","","","","",0,0,0,0,443
440,"A Zeileis, F Leisch, K Hornik, C Kleiber","strucchange. An R package for testing for structural change in linear regression models.",2001,"","epub.wu.ac.at","http://epub.wu.ac.at/1124/","https://scholar.google.com/scholar?cites=4426396069707845061&as_sdt=5,33&sciodt=0,33&hl=en&num=20",83,"2017-06-15","","","","",0,0,0,0,440
433,"B Rosner, D Spiegelman…","Correction of logistic regression relative risk estimates and confidence intervals for measurement error: the case of multiple covariates measured with error",1990,"American journal of …","Oxford Univ Press","http://aje.oxfordjournals.org/content/132/4/734.short","https://scholar.google.com/scholar?cites=18358227972132862553&as_sdt=5,33&sciodt=0,33&hl=en&num=20",787,"2017-06-15","","","","",0,0,0,0,433
429,"WS DeSarbo, WL Cron","A maximum likelihood methodology for clusterwise linear regression",1988,"Journal of classification","Springer","http://www.springerlink.com/index/Q228J20532302441.pdf","https://scholar.google.com/scholar?cites=8083805332081623309&as_sdt=5,33&sciodt=0,33&hl=en&num=20",82,"2017-06-15","","","","",0,0,0,0,429
418,"S Gaffney, P Smyth","Trajectory clustering with mixtures of regression models",1999,"Proceedings of the fifth ACM SIGKDD international …","dl.acm.org","http://dl.acm.org/citation.cfm?id=312198","https://scholar.google.com/scholar?cites=12476192628260870754&as_sdt=5,33&sciodt=0,33&hl=en&num=20",762,"2017-06-15","","","","",0,0,0,0,418
414,"B Efron","Double exponential families and their use in generalized linear regression",1986,"Journal of the American Statistical Association","Taylor & Francis","http://www.tandfonline.com/doi/abs/10.1080/01621459.1986.10478327","https://scholar.google.com/scholar?cites=9772729360291445965&as_sdt=5,33&sciodt=0,33&hl=en&num=20",84,"2017-06-15","","","","",0,0,0,0,414
413,"TA Max, HE Burkhart","Segmented polynomial regression applied to taper equations",1976,"Forest Science","ingentaconnect.com","http://www.ingentaconnect.com/content/saf/fs/1976/00000022/00000003/art00011","https://scholar.google.com/scholar?cites=5250233239796199350&as_sdt=5,33&sciodt=0,33&hl=en&num=20",561,"2017-06-15","","","","",0,0,0,0,413
410,"LS Aiken, SG West, SC Pitts","Multiple linear regression",2003,"Handbook of psychology","Wiley Online Library","http://onlinelibrary.wiley.com/doi/10.1002/0471264385.wei0219/full","https://scholar.google.com/scholar?cites=16705599717746728998&as_sdt=5,33&sciodt=0,33&hl=en&num=20",105,"2017-06-15","","","","",0,0,0,0,410
408,"A Zeileis, T Hothorn","Diagnostic checking in regression relationships",2002,"","idg.pl","http://idg.pl/mirrors/CRAN/web/packages/lmtest/vignettes/lmtest-intro.pdf","https://scholar.google.com/scholar?cites=11575218332072879458&as_sdt=5,33&sciodt=0,33&hl=en&num=20",415,"2017-06-15","PDF","","","",0,0,0,0,408
404,"YS Ho, WT Chiu, CC Wang","Regression analysis for the sorption isotherms of basic dyes on sugarcane dust",2005,"Bioresource technology","Elsevier","http://www.sciencedirect.com/science/article/pii/S0960852404003694","https://scholar.google.com/scholar?cites=1614766408254362190&as_sdt=5,33&sciodt=0,33&hl=en&num=20",528,"2017-06-15","","","","",0,0,0,0,404
390,"JA Dubin, D Rivers","Selection bias in linear regression, logit and probit models",1989,"Sociological Methods & Research","journals.sagepub.com","http://journals.sagepub.com/doi/abs/10.1177/0049124189018002006","https://scholar.google.com/scholar?cites=15436722193192770595&as_sdt=5,33&sciodt=0,33&hl=en&num=20",90,"2017-06-15","","","","",0,0,0,0,390
383,"J Opfermann","Kinetic analysis using multivariate non-linear regression. I. Basic concepts",2000,"Journal of thermal analysis and calorimetry","akademiai.com","http://www.akademiai.com/doi/abs/10.1023/A%3A1010167626551","https://scholar.google.com/scholar?cites=2532268243465432044&as_sdt=5,33&sciodt=0,33&hl=en&num=20",81,"2017-06-15","","","","",0,0,0,0,383
383,"AB Newman, G Foster, R Givelber…","Progression and regression of sleep-disordered breathing with changes in weight: the Sleep Heart Health Study",2005,"Archives of internal …","jamanetwork.com","http://jamanetwork.com/journals/jamainternalmedicine/fullarticle/486784","https://scholar.google.com/scholar?cites=2581023567590623739&as_sdt=5,33&sciodt=0,33&hl=en&num=20",967,"2017-06-15","HTML","","","",0,0,0,0,383
380,"O Hauk, MH Davis, M Ford, F Pulvermüller…","The time course of visual word recognition as revealed by linear regression analysis of ERP data",2006,"Neuroimage","Elsevier","http://www.sciencedirect.com/science/article/pii/S1053811905024663","https://scholar.google.com/scholar?cites=11158361492526810455&as_sdt=5,33&sciodt=0,33&hl=en&num=20",104,"2017-06-15","","","","",0,0,0,0,380
372,"RE Wright","Logistic regression.",1995,"","psycnet.apa.org","http://psycnet.apa.org/psycinfo/1995-97110-007","https://scholar.google.com/scholar?cites=10950780631755887857&as_sdt=5,33&sciodt=0,33&hl=en&num=20",398,"2017-06-15","","","","",0,0,0,0,372
371,"L Breiman, JH Friedman","Predicting multivariate responses in multiple linear regression",1997,"Journal of the Royal Statistical …","Wiley Online Library","http://onlinelibrary.wiley.com/doi/10.1111/1467-9868.00054/full","https://scholar.google.com/scholar?cites=12861000920630252660&as_sdt=5,33&sciodt=0,33&hl=en&num=20",151,"2017-06-15","","","","",0,0,0,0,371
368,"JM Landwehr, D Pregibon…","Graphical methods for assessing logistic regression models",1984,"Journal of the …","amstat.tandfonline.com","http://amstat.tandfonline.com/doi/abs/10.1080/01621459.1984.10477062","https://scholar.google.com/scholar?cites=16253664637440006756&as_sdt=5,33&sciodt=0,33&hl=en&num=20",954,"2017-06-15","","","","",0,0,0,0,368
365,"AM Almeida, MM Castel-Branco, AC Falcao","Linear regression for calibration lines revisited: weighting schemes for bioanalytical methods",2002,"Journal of Chromatography B","Elsevier","http://www.sciencedirect.com/science/article/pii/S1570023202002441","https://scholar.google.com/scholar?cites=14191601863842936104&as_sdt=5,33&sciodt=0,33&hl=en&num=20",64,"2017-06-15","","","","",0,0,0,0,365
362,"HM Wagner","Linear programming techniques for regression analysis",1959,"Journal of the American Statistical Association","Taylor & Francis","http://www.tandfonline.com/doi/abs/10.1080/01621459.1959.10501506","https://scholar.google.com/scholar?cites=15309511409476667962&as_sdt=5,33&sciodt=0,33&hl=en&num=20",54,"2017-06-15","","","","",0,0,0,0,362
362,"F Yao, HG Müller, JL Wang","Functional linear regression analysis for longitudinal data",2005,"The Annals of Statistics","projecteuclid.org","http://projecteuclid.org/euclid.aos/1140191677","https://scholar.google.com/scholar?cites=16168347097352720381&as_sdt=5,33&sciodt=0,33&hl=en&num=20",100,"2017-06-15","","","","",0,0,0,0,362
362,"K Pearson","On the theory of contingency and its relation to association and normal correlation; On the general theory of skew correlation and non-linear regression",1904,"","Cambridge University Press","","https://scholar.google.com/scholar?cites=4513797469488450027&as_sdt=5,33&sciodt=0,33&hl=en&num=20",112,"2017-06-15","CITATION","","","",0,0,0,0,362
361,"CFJ Lin, T Teräsvirta","Testing the constancy of regression parameters against continuous structural change",1994,"Journal of Econometrics","Elsevier","http://www.sciencedirect.com/science/article/pii/0304407694900221","https://scholar.google.com/scholar?cites=12500168172763549339&as_sdt=5,33&sciodt=0,33&hl=en&num=20",198,"2017-06-15","","","","",0,0,0,0,361
360,"DW Davis","Optimum linear regression and error estimation applied to U–Pb data",1982,"Canadian Journal of Earth Sciences","NRC Research Press","http://www.nrcresearchpress.com/doi/abs/10.1139/e82-188","https://scholar.google.com/scholar?cites=9134901576746893692&as_sdt=5,33&sciodt=0,33&hl=en&num=20",127,"2017-06-15","","","","",0,0,0,0,360
359,"DA Savic, W Pedrycz","Evaluation of fuzzy linear regression models",1991,"Fuzzy sets and systems","Elsevier","http://www.sciencedirect.com/science/article/pii/016501149190065X","https://scholar.google.com/scholar?cites=885505422012359167&as_sdt=5,33&sciodt=0,33&hl=en&num=20",70,"2017-06-15","","","","",0,0,0,0,359
351,"W Bablok, H Passing, R Bender…","A general regression procedure for method transformation. Application of linear regression procedures for method comparison studies in clinical chemistry, Part III",1988,"Clinical Chemistry and …","degruyter.com","https://www.degruyter.com/view/j/cclm.1988.26.issue-11/cclm.1988.26.11.783/cclm.1988.26.11.783.xml","https://scholar.google.com/scholar?cites=5682811362848545672&as_sdt=5,33&sciodt=0,33&hl=en&num=20",110,"2017-06-15","","","","",0,0,0,0,351
350,"Y Ritov","Estimation in a linear regression model with censored data",1990,"The Annals of Statistics","JSTOR","http://www.jstor.org/stable/2241545","https://scholar.google.com/scholar?cites=883172170348281594&as_sdt=5,33&sciodt=0,33&hl=en&num=20",91,"2017-06-15","","","","",0,0,0,0,350
349,"W Ploberger, W Krämer, K Kontrus","A new test for structural stability in the linear regression model",1989,"Journal of Econometrics","Elsevier","http://www.sciencedirect.com/science/article/pii/0304407689900870","https://scholar.google.com/scholar?cites=3499715991935647471&as_sdt=5,33&sciodt=0,33&hl=en&num=20",80,"2017-06-15","","","","",0,0,0,0,349
343,"H Tanaka, I Hayashi, J Watada","Possibilistic linear regression analysis for fuzzy data",1989,"European Journal of Operational …","Elsevier","http://www.sciencedirect.com/science/article/pii/0377221789904311","https://scholar.google.com/scholar?cites=10280668290207494072&as_sdt=5,33&sciodt=0,33&hl=en&num=20",76,"2017-06-15","","","","",0,0,0,0,343
341,"RT O'Connell, AB Koehler","Forecasting, time series, and regression: An applied approach",2005,"","South-Western Pub","","https://scholar.google.com/scholar?cites=14436018130226076814&as_sdt=5,33&sciodt=0,33&hl=en&num=20",258,"2017-06-15","CITATION","","","",0,0,0,0,341
339,"Gallant","Nonlinear regression",1975,"The American Statistician","Taylor & Francis","http://www.tandfonline.com/doi/pdf/10.1080/00031305.1975.10477374","https://scholar.google.com/scholar?cites=2995988831343267677&as_sdt=5,33&sciodt=0,33&hl=en&num=20",854,"2017-06-15","","","","",0,0,0,0,339
337,"LJ Revell","Phylogenetic signal and linear regression on species data",2010,"Methods in Ecology and Evolution","Wiley Online Library","http://onlinelibrary.wiley.com/doi/10.1111/j.2041-210X.2010.00044.x/full","https://scholar.google.com/scholar?cites=10336670123992458594&as_sdt=5,33&sciodt=0,33&hl=en&num=20",144,"2017-06-15","HTML","","","",0,0,0,0,337
333,"JJ Beauchamp, JS Olson","Corrections for bias in regression estimates after logarithmic transformation",1973,"Ecology","Wiley Online Library","http://onlinelibrary.wiley.com/doi/10.2307/1934208/full","https://scholar.google.com/scholar?cites=6093569954423078629&as_sdt=5,33&sciodt=0,33&hl=en&num=20",830,"2017-06-15","","","","",0,0,0,0,333
332,"AM Brown","A step-by-step guide to non-linear regression analysis of experimental data using a Microsoft Excel spreadsheet",2001,"Computer methods and programs in biomedicine","Elsevier","http://www.sciencedirect.com/science/article/pii/S0169260700001243","https://scholar.google.com/scholar?cites=3552467189742596928&as_sdt=5,33&sciodt=0,33&hl=en&num=20",88,"2017-06-15","","","","",0,0,0,0,332
329,"ER Berndt, NE Savin","Conflict among criteria for testing hypotheses in the multivariate linear regression model",1977,"Econometrica: Journal of the Econometric Society","JSTOR","http://www.jstor.org/stable/1914072","https://scholar.google.com/scholar?cites=9053373951403174633&as_sdt=5,33&sciodt=0,33&hl=en&num=20",93,"2017-06-15","","","","",0,0,0,0,329
321,"RL Eubank, CH Spiegelman","Testing the goodness of fit of a linear model via nonparametric regression techniques",1990,"Journal of the American …","amstat.tandfonline.com","http://amstat.tandfonline.com/doi/abs/10.1080/01621459.1990.10476211","https://scholar.google.com/scholar?cites=1249153948662818667&as_sdt=5,33&sciodt=0,33&hl=en&num=20",85,"2017-06-15","","","","",0,0,0,0,321
317,"G Peters","Fuzzy linear regression with fuzzy intervals",1994,"Fuzzy Sets and Systems","Elsevier","http://www.sciencedirect.com/science/article/pii/0165011494901449","https://scholar.google.com/scholar?cites=11688084214809147265&as_sdt=5,33&sciodt=0,33&hl=en&num=20",78,"2017-06-15","","","","",0,0,0,0,317
306,"DWK Andrews, I Lee, W Ploberger","Optimal changepoint tests for normal linear regression",1996,"Journal of Econometrics","Elsevier","http://www.sciencedirect.com/science/article/pii/0304407694016828","https://scholar.google.com/scholar?cites=6055902474135924702&as_sdt=5,33&sciodt=0,33&hl=en&num=20",41,"2017-06-15","","","","",0,0,0,0,306
306,"LJ Wei","The accelerated failure time model: a useful alternative to the Cox regression model in survival analysis",1992,"Statistics in medicine","Wiley Online Library","http://onlinelibrary.wiley.com/doi/10.1002/sim.4780111409/full","https://scholar.google.com/scholar?cites=352075665390659165&as_sdt=5,33&sciodt=0,33&hl=en&num=20",803,"2017-06-15","","","","",0,0,0,0,306
304,"SIV Sousa, FG Martins, MCM Alvim-Ferraz…","Multiple linear regression and artificial neural networks based on principal components to predict ozone concentrations",2007,"… Modelling & Software","Elsevier","http://www.sciencedirect.com/science/article/pii/S1364815205002240","https://scholar.google.com/scholar?cites=14723642471090515743&as_sdt=5,33&sciodt=0,33&hl=en&num=20",95,"2017-06-15","","","","",0,0,0,0,304
302,"Y Fu, TS Huang","Human age estimation with regression on discriminative aging manifold",2008,"IEEE Transactions on Multimedia","ieeexplore.ieee.org","http://ieeexplore.ieee.org/abstract/document/4523958/","https://scholar.google.com/scholar?cites=3791711583011101890&as_sdt=5,33&sciodt=0,33&hl=en&num=20",907,"2017-06-15","","","","",0,0,0,0,302
301,"L Kejian","A new class of blased estimate in linear regression",1993,"Communications in Statistics-Theory and Methods","Taylor & Francis","http://www.tandfonline.com/doi/pdf/10.1080/03610929308831027","https://scholar.google.com/scholar?cites=13559751185697713834&as_sdt=5,33&sciodt=0,33&hl=en&num=20",71,"2017-06-15","","","","",0,0,0,0,301
295,"J Geweke","Exact inference in the inequality constrained normal linear regression model",1986,"Journal of Applied Econometrics","Wiley Online Library","http://onlinelibrary.wiley.com/doi/10.1002/jae.3950010203/full","https://scholar.google.com/scholar?cites=4177146370785451419&as_sdt=5,33&sciodt=0,33&hl=en&num=20",97,"2017-06-15","","","","",0,0,0,0,295
292,"C Toro-Vizcarrondo…","A test of the mean square error criterion for restrictions in linear regression",1968,"Journal of the American …","amstat.tandfonline.com","http://amstat.tandfonline.com/doi/abs/10.1080/01621459.1968.11009275","https://scholar.google.com/scholar?cites=1286079366164158840&as_sdt=5,33&sciodt=0,33&hl=en&num=20",98,"2017-06-15","","","","",0,0,0,0,292
291,"AR Gallant, WA Fuller","Fitting segmented polynomial regression models whose join points have to be estimated",1973,"Journal of the American Statistical …","amstat.tandfonline.com","http://amstat.tandfonline.com/doi/abs/10.1080/01621459.1973.10481353","https://scholar.google.com/scholar?cites=8963821787496528973&as_sdt=5,33&sciodt=0,33&hl=en&num=20",491,"2017-06-15","","","","",0,0,0,0,291
286,"TT Cai, P Hall","Prediction in functional linear regression",2006,"The Annals of Statistics","projecteuclid.org","http://projecteuclid.org/euclid.aos/1169571793","https://scholar.google.com/scholar?cites=4022917603506522761&as_sdt=5,33&sciodt=0,33&hl=en&num=20",124,"2017-06-15","","","","",0,0,0,0,286
285,"TC Koopmans","Linear regression analysis of economic time series",1937,"","De erven F. Bohn nv","","https://scholar.google.com/scholar?cites=2438748354879377863&as_sdt=5,33&sciodt=0,33&hl=en&num=20",62,"2017-06-15","CITATION","","","",0,0,0,0,285
283,"A Skumanich, C Smythe…","On the statistical description of inhomogeneities in the quiet solar atmosphere. I-Linear regression analysis and absolute calibration of multichannel …",1975,"The Astrophysical …","adsabs.harvard.edu","http://adsabs.harvard.edu/full/1975ApJ...200..747S","https://scholar.google.com/scholar?cites=7094625413677820283&as_sdt=5,33&sciodt=0,33&hl=en&num=20",149,"2017-06-15","HTML","","","",0,0,0,0,283
283,"FJ Janzen, HS Stern","Logistic regression for empirical studies of multivariate selection",1998,"Evolution","JSTOR","http://www.jstor.org/stable/2411330","https://scholar.google.com/scholar?cites=16395572984238905963&as_sdt=5,33&sciodt=0,33&hl=en&num=20",963,"2017-06-15","","","","",0,0,0,0,283
282,"P Hall, JL Horowitz","Methodology and convergence rates for functional linear regression",2007,"The Annals of Statistics","projecteuclid.org","http://projecteuclid.org/euclid.aos/1181100181","https://scholar.google.com/scholar?cites=4939708322029703280&as_sdt=5,33&sciodt=0,33&hl=en&num=20",130,"2017-06-15","","","","",0,0,0,0,282
281,"YHO Chang, BM Ayyub","Fuzzy regression methods–a comparative assessment",2001,"Fuzzy sets and systems","Elsevier","http://www.sciencedirect.com/science/article/pii/S0165011499000913","https://scholar.google.com/scholar?cites=10297592054589315047&as_sdt=5,33&sciodt=0,33&hl=en&num=20",391,"2017-06-15","","","","",0,0,0,0,281
280,"H Passing, W Bablok","Comparison of several regression procedures for method comparison studies and determination of sample sizes application of linear regression procedures for …",1984,"Clinical Chemistry and Laboratory Medicine","degruyter.com","https://www.degruyter.com/view/j/cclm.1984.22.issue-6/cclm.1984.22.6.431/cclm.1984.22.6.431.xml","https://scholar.google.com/scholar?cites=1332706744549734373&as_sdt=5,33&sciodt=0,33&hl=en&num=20",150,"2017-06-15","","","","",0,0,0,0,280
277,"CM Cassel, CE Särndal, JH Wretman","Some results on generalized difference estimation and generalized regression estimation for finite populations",1976,"Biometrika","Biometrika Trust","http://biomet.oxfordjournals.org/content/63/3/615.short","https://scholar.google.com/scholar?cites=14514987079984147467&as_sdt=5,33&sciodt=0,33&hl=en&num=20",753,"2017-06-15","","","","",0,0,0,0,277
275,"X Yan, X Su","Linear regression analysis: theory and computing",2009,"","books.google.com","https://books.google.com/books?hl=en&lr=&id=5pdpDQAAQBAJ&oi=fnd&pg=PR5&dq=linear+regression&ots=ChGIeYhzVh&sig=0sDgTXwM7UgtGkbbyLKvl1fdO6c","https://scholar.google.com/scholar?cites=17009928803337693690&as_sdt=5,33&sciodt=0,33&hl=en&num=20",215,"2017-06-15","BOOK","","","",0,0,0,0,275
269,"KB Song, YS Baek, DH Hong…","Short-term load forecasting for the holidays using fuzzy linear regression method",2005,"IEEE transactions on …","ieeexplore.ieee.org","http://ieeexplore.ieee.org/abstract/document/1388498/","https://scholar.google.com/scholar?cites=1530342290120539453&as_sdt=5,33&sciodt=0,33&hl=en&num=20",99,"2017-06-15","","","","",0,0,0,0,269
269,"A Gelman, G Imbens","Why high-order polynomials should not be used in regression discontinuity designs",2014,"","nber.org","http://www.nber.org/papers/w20405.pdf","https://scholar.google.com/scholar?cites=1444983362900100850&as_sdt=5,33&sciodt=0,33&hl=en&num=20",904,"2017-06-15","","","","",0,0,0,0,269
265,"MGB Blum, O François","Non-linear regression models for Approximate Bayesian Computation",2010,"Statistics and computing","Springer","http://www.springerlink.com/index/75723514704620X3.pdf","https://scholar.google.com/scholar?cites=16803933202778982709&as_sdt=5,33&sciodt=0,33&hl=en&num=20",119,"2017-06-15","","","","",0,0,0,0,265
