Cites,Authors,Title,Year,Source,Publisher,ArticleURL,CitesURL,GSRank,QueryDate,Type,DOI,ISSN,CitationURL,Volume,Issue,StartPage,EndPage,ECC
128,"SD Smith","Earthmoving productivity estimation using linear regression techniques",1999,"Journal of Construction Engineering and Management","ascelibrary.org","http://ascelibrary.org/doi/abs/10.1061/(ASCE)0733-9364(1999)125:3(133)","https://scholar.google.com/scholar?cites=16366147440771184249&as_sdt=5,33&sciodt=0,33&hl=en&num=20",237,"2017-06-15","","","","",0,0,0,0,128
128,"J Riu, FX Rius","Assessing the accuracy of analytical methods using linear regression with errors in both axes",1996,"Analytical Chemistry","ACS Publications","http://pubs.acs.org/doi/abs/10.1021/ac951217s","https://scholar.google.com/scholar?cites=18090571485116515689&as_sdt=5,33&sciodt=0,33&hl=en&num=20",285,"2017-06-15","","","","",0,0,0,0,128
128,"P Pérez, G de los Campos, J Crossa…","Genomic-enabled prediction based on molecular markers and pedigree using the Bayesian linear regression package in R",2010,"The plant …","dl.sciencesocieties.org","https://dl.sciencesocieties.org/publications/tpg/abstracts/3/2/106","https://scholar.google.com/scholar?cites=2511737984029101639&as_sdt=5,33&sciodt=0,33&hl=en&num=20",302,"2017-06-15","","","","",0,0,0,0,128
128,"J Hoeting, AE Raftery, D Madigan","A method for simultaneous variable selection and outlier identification in linear regression",1996,"Computational Statistics & Data …","Elsevier","http://www.sciencedirect.com/science/article/pii/0167947395000534","https://scholar.google.com/scholar?cites=17404327304947701308&as_sdt=5,33&sciodt=0,33&hl=en&num=20",307,"2017-06-15","","","","",0,0,0,0,128
128,"O Linton","Second order approximation in the partially linear regression model",1995,"Econometrica: Journal of the Econometric Society","JSTOR","http://www.jstor.org/stable/2171722","https://scholar.google.com/scholar?cites=7540607586256564984&as_sdt=5,33&sciodt=0,33&hl=en&num=20",328,"2017-06-15","","","","",0,0,0,0,128
128,"N Chernov","Circular and linear regression: Fitting circles and lines by least squares",2010,"","books.google.com","https://books.google.com/books?hl=en&lr=&id=GmHRBQAAQBAJ&oi=fnd&pg=PP1&dq=linear+regression&ots=WowlDk0t9e&sig=4gQyI-HlZhEQQ0WuGnPaOznd9k8","https://scholar.google.com/scholar?cites=12374179954422009606&as_sdt=5,33&sciodt=0,33&hl=en&num=20",487,"2017-06-15","BOOK","","","",0,0,0,0,128
127,"F Freese","Linear regression methods for forest research",1964,"","fpl.fs.fed.us","http://www.fpl.fs.fed.us/products/publications/specific_pub.php?posting_id=18000&header_id=p","https://scholar.google.com/scholar?cites=4198498681484399482&as_sdt=5,33&sciodt=0,33&hl=en&num=20",152,"2017-06-15","BOOK","","","",0,0,0,0,127
127,"Z Yuan, Y Yang","Combining linear regression models: When and how?",2005,"Journal of the American Statistical …","amstat.tandfonline.com","http://amstat.tandfonline.com/doi/abs/10.1198/016214505000000088","https://scholar.google.com/scholar?cites=16835444159227765911&as_sdt=5,33&sciodt=0,33&hl=en&num=20",356,"2017-06-15","","","","",0,0,0,0,127
125,"B Abraham, J Ledolter","Introduction to regression modeling",2006,"","Thomson Brooks/Cole","","https://scholar.google.com/scholar?cites=12248353995760401126&as_sdt=5,33&sciodt=0,33&hl=en&num=20",651,"2017-06-15","CITATION","","","",0,0,0,0,125
124,"SX Chen","On the accuracy of empirical likelihood confidence regions for linear regression model",1993,"Annals of the Institute of Statistical Mathematics","Springer","http://www.springerlink.com/index/J3341941741250G3.pdf","https://scholar.google.com/scholar?cites=15322752840280692406&as_sdt=5,33&sciodt=0,33&hl=en&num=20",273,"2017-06-15","","","","",0,0,0,0,124
124,"C Maze, G Burnet","A non-linear regression method for calculating surface tension and contact angle from the shape of a sessile drop",1969,"Surface Science","Elsevier","http://www.sciencedirect.com/science/article/pii/0039602869902040","https://scholar.google.com/scholar?cites=10381916003256458644&as_sdt=5,33&sciodt=0,33&hl=en&num=20",284,"2017-06-15","","","","",0,0,0,0,124
124,"R Coppi, P D'Urso, P Giordani, A Santoro","Least squares estimation of a linear regression model with LR fuzzy response",2006,"Computational Statistics & Data …","Elsevier","http://www.sciencedirect.com/science/article/pii/S0167947306001332","https://scholar.google.com/scholar?cites=9013086502898216092&as_sdt=5,33&sciodt=0,33&hl=en&num=20",325,"2017-06-15","","","","",0,0,0,0,124
124,"RJGM Florax, T De Graaff","The performance of diagnostic tests for spatial dependence in linear regression models: a meta-analysis of simulation studies",2004,"Advances in spatial econometrics","Springer","http://link.springer.com/chapter/10.1007/978-3-662-05617-2_2","https://scholar.google.com/scholar?cites=8066645235610378843&as_sdt=5,33&sciodt=0,33&hl=en&num=20",385,"2017-06-15","","","","",0,0,0,0,124
123,"P Koeppe, C Hamann","A program for non-linear regression analysis to be used on desk-top computers",1980,"Computer programs in biomedicine","Elsevier","http://www.sciencedirect.com/science/article/pii/0010468X80900586","https://scholar.google.com/scholar?cites=2113299753796593126&as_sdt=5,33&sciodt=0,33&hl=en&num=20",266,"2017-06-15","","","","",0,0,0,0,123
123,"SX Chen","Empirical likelihood confidence intervals for linear regression coefficients",1994,"Journal of Multivariate Analysis","Elsevier","http://www.sciencedirect.com/science/article/pii/S0047259X84710116","https://scholar.google.com/scholar?cites=4236322943265584931&as_sdt=5,33&sciodt=0,33&hl=en&num=20",278,"2017-06-15","","","","",0,0,0,0,123
123,"R Kalaba, L Tesfatsion","Time-varying linear regression via flexible least squares",1989,"Computers & Mathematics with Applications","Elsevier","http://www.sciencedirect.com/science/article/pii/0898122189900916","https://scholar.google.com/scholar?cites=6937558510198256882&as_sdt=5,33&sciodt=0,33&hl=en&num=20",390,"2017-06-15","HTML","","","",0,0,0,0,123
122,"AJ Stromberg","Computing the exact least median of squares estimate and stability diagnostics in multiple linear regression",1993,"SIAM Journal on Scientific Computing","SIAM","http://epubs.siam.org/doi/abs/10.1137/0914076","https://scholar.google.com/scholar?cites=3852093207271752012&as_sdt=5,33&sciodt=0,33&hl=en&num=20",271,"2017-06-15","","","","",0,0,0,0,122
122,"K LIU","Measurement error and its impact on partial correlation and multiple linear regression analyses",1988,"American Journal of Epidemiology","Oxford Univ Press","http://aje.oxfordjournals.org/content/127/4/864.short","https://scholar.google.com/scholar?cites=16343911258201409661&as_sdt=5,33&sciodt=0,33&hl=en&num=20",280,"2017-06-15","","","","",0,0,0,0,122
121,"C Kao, CL Chyu","A fuzzy linear regression model with better explanatory power",2002,"Fuzzy sets and systems","Elsevier","http://www.sciencedirect.com/science/article/pii/S0165011401000690","https://scholar.google.com/scholar?cites=18360650615817114140&as_sdt=5,33&sciodt=0,33&hl=en&num=20",138,"2017-06-15","","","","",0,0,0,0,121
121,"WP Du Plessis","Linear regression relationships between NDVI, vegetation and rainfall in Etosha National Park, Namibia",1999,"Journal of Arid Environments","Elsevier","http://www.sciencedirect.com/science/article/pii/S0140196399905050","https://scholar.google.com/scholar?cites=14037532264835689212&as_sdt=5,33&sciodt=0,33&hl=en&num=20",277,"2017-06-15","","","","",0,0,0,0,121
121,"K Pearson","On the general theory of skew correlation and non-linear regression",1905,"","books.google.com","https://books.google.com/books?hl=en&lr=&id=S6YSAAAAYAAJ&oi=fnd&pg=PA1&dq=linear+regression&ots=6_Jhiy1PTR&sig=LN9WDQ4hpKabC3iNxO4kGwK7olw","https://scholar.google.com/scholar?cites=12663578070600718528&as_sdt=5,33&sciodt=0,33&hl=en&num=20",426,"2017-06-15","BOOK","","","",0,0,0,0,121
118,"WG Cochran","The omission or addition of an independent variate in multiple linear regression",1938,"Supplement to the Journal of the Royal Statistical …","JSTOR","http://www.jstor.org/stable/2983654","https://scholar.google.com/scholar?cites=18058442295599687642&as_sdt=5,33&sciodt=0,33&hl=en&num=20",257,"2017-06-15","","","","",0,0,0,0,118
118,"H Bourennane, D King, A Couturier","Comparison of kriging with external drift and simple linear regression for predicting soil horizon thickness with different sample densities",2000,"Geoderma","Elsevier","http://www.sciencedirect.com/science/article/pii/S0016706100000422","https://scholar.google.com/scholar?cites=1928742215037402819&as_sdt=5,33&sciodt=0,33&hl=en&num=20",289,"2017-06-15","","","","",0,0,0,0,118
117,"KA McNeil, FJ Kelly, JT McNeil","Testing research hypotheses using multiple linear regression",1975,"","Southern Illinois Univ Pr","","https://scholar.google.com/scholar?cites=9263992402118990397&as_sdt=5,33&sciodt=0,33&hl=en&num=20",203,"2017-06-15","CITATION","","","",0,0,0,0,117
117,"G Aneiros-Pérez, P Vieu","Semi-functional partial linear regression",2006,"Statistics & Probability Letters","Elsevier","http://www.sciencedirect.com/science/article/pii/S0167715205004530","https://scholar.google.com/scholar?cites=8266239217526972054&as_sdt=5,33&sciodt=0,33&hl=en&num=20",319,"2017-06-15","","","","",0,0,0,0,117
116,"RE Kopp, RJ Orford","Linear regression applied to system identification for adaptive control systems",1963,"Aiaa Journal","arc.aiaa.org","http://arc.aiaa.org/doi/pdf/10.2514/3.2056","https://scholar.google.com/scholar?cites=6476192668360949555&as_sdt=5,33&sciodt=0,33&hl=en&num=20",315,"2017-06-15","","","","",0,0,0,0,116
116,"ZZ Wang, JH Yong","Texture analysis and classification with linear regression model based on wavelet transform",2008,"IEEE Transactions on Image Processing","ieeexplore.ieee.org","http://ieeexplore.ieee.org/abstract/document/4553726/","https://scholar.google.com/scholar?cites=8028243557996408112&as_sdt=5,33&sciodt=0,33&hl=en&num=20",359,"2017-06-15","","","","",0,0,0,0,116
116,"HC Rutemiller, DA Bowers","Estimation in a heteroscedastic regression model",1968,"Journal of the American …","amstat.tandfonline.com","http://amstat.tandfonline.com/doi/abs/10.1080/01621459.1968.11009274","https://scholar.google.com/scholar?cites=12514279972419138524&as_sdt=5,33&sciodt=0,33&hl=en&num=20",946,"2017-06-15","","","","",0,0,0,0,116
115,"X Huang, W Pan","Linear regression and two-class classification with gene expression data",2003,"Bioinformatics","Oxford Univ Press","http://bioinformatics.oxfordjournals.org/content/19/16/2072.short","https://scholar.google.com/scholar?cites=9813730974500257622&as_sdt=5,33&sciodt=0,33&hl=en&num=20",306,"2017-06-15","","","","",0,0,0,0,115
115,"L Gu","A comparison of polynomial based regression models in vehicle safety analysis",2001,"… Engineering Technical Conferences, ASME Paper No.: …","","","https://scholar.google.com/scholar?cites=6177407376982903890&as_sdt=5,33&sciodt=0,33&hl=en&num=20",344,"2017-06-15","CITATION","","","",0,0,0,0,115
114,"MW Browne","Predictive validity of a linear regression equation",1975,"British Journal of Mathematical and Statistical …","Wiley Online Library","http://onlinelibrary.wiley.com/doi/10.1111/j.2044-8317.1975.tb00550.x/full","https://scholar.google.com/scholar?cites=516890904930915312&as_sdt=5,33&sciodt=0,33&hl=en&num=20",264,"2017-06-15","","","","",0,0,0,0,114
113,"M Jansson, B Wahlberg","A linear regression approach to state-space subspace system identification",1996,"Signal Processing","Elsevier","http://www.sciencedirect.com/science/article/pii/0165168496000485","https://scholar.google.com/scholar?cites=1389211379252773641&as_sdt=5,33&sciodt=0,33&hl=en&num=20",424,"2017-06-15","","","","",0,0,0,0,113
112,"T Gerrodette","TRENDS: Software for a power analysis of linear regression",1993,"","JSTOR","","https://scholar.google.com/scholar?cites=17704811609215366207&as_sdt=5,33&sciodt=0,33&hl=en&num=20",197,"2017-06-15","CITATION","","","",0,0,0,0,112
111,"B Rosenberg","Linear regression with randomly dispersed parameters",1973,"Biometrika","JSTOR","http://www.jstor.org/stable/2334906","https://scholar.google.com/scholar?cites=16779363481058688918&as_sdt=5,33&sciodt=0,33&hl=en&num=20",274,"2017-06-15","","","","",0,0,0,0,111
111,"BD Marx","Iteratively reweighted partial least squares estimation for generalized linear regression",1996,"Technometrics","Taylor & Francis","http://www.tandfonline.com/doi/abs/10.1080/00401706.1996.10484549","https://scholar.google.com/scholar?cites=5608869334565610833&as_sdt=5,33&sciodt=0,33&hl=en&num=20",327,"2017-06-15","","","","",0,0,0,0,111
111,"SK Gardiner, DP Crabb","Examination of different pointwise linear regression methods for determining visual field progression",2002,"Investigative ophthalmology & visual …","jov.arvojournals.org","http://jov.arvojournals.org/article.aspx?articleid=2123577","https://scholar.google.com/scholar?cites=12709161485770951092&as_sdt=5,33&sciodt=0,33&hl=en&num=20",382,"2017-06-15","HTML","","","",0,0,0,0,111
110,"M Galea, GA Paula, H Bolfarine","Local influence in elliptical linear regression models",1997,"Journal of the Royal Statistical …","Wiley Online Library","http://onlinelibrary.wiley.com/doi/10.1111/1467-9884.00060/full","https://scholar.google.com/scholar?cites=8457482741120730008&as_sdt=5,33&sciodt=0,33&hl=en&num=20",283,"2017-06-15","","","","",0,0,0,0,110
110,"H Sun, HX Liu, H Xiao, RR He, B Ran","Short term traffic forecasting using the local linear regression model",2003,"82nd Annual Meeting of the …","its.uci.edu","http://www.its.uci.edu/its/publications/papers/CTSS/UCI-ITS-TS-WP-02-5.pdf","https://scholar.google.com/scholar?cites=2276339870259829712&as_sdt=5,33&sciodt=0,33&hl=en&num=20",286,"2017-06-15","PDF","","","",0,0,0,0,110
110,"AA Afifi, RM Elashoff","Missing observations in multivariate statistics II. Point estimation in simple linear regression",1967,"Journal of the American Statistical …","amstat.tandfonline.com","http://amstat.tandfonline.com/doi/abs/10.1080/01621459.1967.10482884","https://scholar.google.com/scholar?cites=9813642522207385112&as_sdt=5,33&sciodt=0,33&hl=en&num=20",393,"2017-06-15","","","","",0,0,0,0,110
109,"LR LaMotte, A McWhorter Jr","An exact test for the presence of random walk coefficients in a linear regression model",1978,"Journal of the American Statistical …","Taylor & Francis","http://www.tandfonline.com/doi/abs/10.1080/01621459.1978.10480105","https://scholar.google.com/scholar?cites=15397411528539958926&as_sdt=5,33&sciodt=0,33&hl=en&num=20",279,"2017-06-15","","","","",0,0,0,0,109
109,"B Erni, F Liechti, LG Underhill, B Bruderer","Wind and rain govern the intensity of nocturnal bird migration in central Europe-a log-linear regression analysis",2002,"Ardea","researchgate.net","https://www.researchgate.net/profile/Bruno_Bruderer/publication/279620347_Wind_and_rain_govern_the_intensity_of_nocturnal_bird_migration_in_central_Europe_-_A_log-linear_regression_analysis/links/5705344808ae74a08e27152e.pdf","https://scholar.google.com/scholar?cites=3598111901626486036&as_sdt=5,33&sciodt=0,33&hl=en&num=20",384,"2017-06-15","PDF","","","",0,0,0,0,109
109,"F Pukelsheim","On linear regression designs which maximize information",1980,"Journal of Statistical Planning and Inference","Elsevier","http://www.sciencedirect.com/science/article/pii/0378375880900208","https://scholar.google.com/scholar?cites=3899632947715566362&as_sdt=5,33&sciodt=0,33&hl=en&num=20",416,"2017-06-15","","","","",0,0,0,0,109
108,"MJ Fadili, ET Bullmore","Wavelet-generalized least squares: a new BLU estimator of linear regression models with 1/f errors",2002,"NeuroImage","Elsevier","http://www.sciencedirect.com/science/article/pii/S1053811901909553","https://scholar.google.com/scholar?cites=11264916950763360573&as_sdt=5,33&sciodt=0,33&hl=en&num=20",261,"2017-06-15","","","","",0,0,0,0,108
108,"KV Kumar, K Porkodi, F Rocha","Isotherms and thermodynamics by linear and non-linear regression analysis for the sorption of methylene blue onto activated carbon: comparison of various error …",2008,"Journal of Hazardous Materials","Elsevier","http://www.sciencedirect.com/science/article/pii/S0304389407009156","https://scholar.google.com/scholar?cites=11590990587574239463&as_sdt=5,33&sciodt=0,33&hl=en&num=20",358,"2017-06-15","","","","",0,0,0,0,108
108,"W Meredith, R Rutledge, SM Fakhry…","The conundrum of the Glasgow Coma Scale in intubated patients: a linear regression prediction of the Glasgow verbal score from the Glasgow eye and motor scores",1998,"Journal of Trauma …","journals.lww.com","http://journals.lww.com/jtrauma/Abstract/1998/05000/The_Conundrum_of_the_Glasgow_Coma_Scale_in.16.aspx","https://scholar.google.com/scholar?cites=8510713391768086778&as_sdt=5,33&sciodt=0,33&hl=en&num=20",422,"2017-06-15","","","","",0,0,0,0,108
107,"M Glasser","Linear regression analysis with missing observations among the independent variables",1964,"Journal of the American Statistical Association","Taylor & Francis","http://www.tandfonline.com/doi/abs/10.1080/01621459.1964.10480730","https://scholar.google.com/scholar?cites=3469403851495115261&as_sdt=5,33&sciodt=0,33&hl=en&num=20",350,"2017-06-15","","","","",0,0,0,0,107
107,"J Mata","Interpretation of concrete dam behaviour with artificial neural network and multiple linear regression models",2011,"Engineering Structures","Elsevier","http://www.sciencedirect.com/science/article/pii/S0141029610004839","https://scholar.google.com/scholar?cites=9765202418130871848&as_sdt=5,33&sciodt=0,33&hl=en&num=20",399,"2017-06-15","","","","",0,0,0,0,107
107,"Y Zhou, CJ Endres, JR Brašić, SC Huang, DF Wong","Linear regression with spatial constraint to generate parametric images of ligand-receptor dynamic PET studies with a simplified reference tissue model",2003,"Neuroimage","Elsevier","http://www.sciencedirect.com/science/article/pii/S105381190300017X","https://scholar.google.com/scholar?cites=2320941909679899596&as_sdt=5,33&sciodt=0,33&hl=en&num=20",403,"2017-06-15","","","","",0,0,0,0,107
106,"W Chou","Maximum a posterior linear regression with elliptically symmetric matrix variate priors.",1999,"Eurospeech","ai2-s2-pdfs.s3.amazonaws.com","http://ai2-s2-pdfs.s3.amazonaws.com/b6ae/237c9eac79e7d1380348a3f29937f33f5bec.pdf","https://scholar.google.com/scholar?cites=17104033529633453887&as_sdt=5,33&sciodt=0,33&hl=en&num=20",260,"2017-06-15","PDF","","","",0,0,0,0,106
106,"H Vermeiren, E Van Craenenbroeck, P Alen…","Prediction of HIV-1 drug susceptibility phenotype from the viral genotype using linear regression modeling",2007,"Journal of virological …","Elsevier","http://www.sciencedirect.com/science/article/pii/S0166093407001735","https://scholar.google.com/scholar?cites=12376786955065188323&as_sdt=5,33&sciodt=0,33&hl=en&num=20",349,"2017-06-15","","","","",0,0,0,0,106
106,"S Kaçiranlar, S Sakallioğlu, F Akdeniz…","A new biased estimator in linear regression and a detailed analysis of the widely-analysed dataset on Portland cement",1999,"Sankhyā: The Indian …","JSTOR","http://www.jstor.org/stable/25053104","https://scholar.google.com/scholar?cites=10080591825033727578&as_sdt=5,33&sciodt=0,33&hl=en&num=20",379,"2017-06-15","","","","",0,0,0,0,106
106,"L Davies","The asymptotics of S-estimators in the linear regression model",1990,"The Annals of Statistics","JSTOR","http://www.jstor.org/stable/2241880","https://scholar.google.com/scholar?cites=10886799306365546399&as_sdt=5,33&sciodt=0,33&hl=en&num=20",412,"2017-06-15","","","","",0,0,0,0,106
106,"H Ishibuchi, M Nii","Fuzzy regression using asymmetric fuzzy coefficients and fuzzified neural networks",2001,"Fuzzy Sets and Systems","Elsevier","http://www.sciencedirect.com/science/article/pii/S0165011498003704","https://scholar.google.com/scholar?cites=4232779651070427928&as_sdt=5,33&sciodt=0,33&hl=en&num=20",508,"2017-06-15","","","","",0,0,0,0,106
105,"A Dobra, J Gehrke","SECRET: a scalable linear regression tree algorithm",2002,"Proceedings of the eighth ACM SIGKDD …","dl.acm.org","http://dl.acm.org/citation.cfm?id=775117","https://scholar.google.com/scholar?cites=7382635532480496460&as_sdt=5,33&sciodt=0,33&hl=en&num=20",339,"2017-06-15","","","","",0,0,0,0,105
105,"M Wedel, C Kistemaker","Consumer benefit segmentation using clusterwise linear regression",1989,"International Journal of Research in Marketing","Elsevier","http://www.sciencedirect.com/science/article/pii/0167811689900463","https://scholar.google.com/scholar?cites=13790231179304346129&as_sdt=5,33&sciodt=0,33&hl=en&num=20",376,"2017-06-15","","","","",0,0,0,0,105
105,"M Sugiyama","Active learning in approximately linear regression based on conditional expectation of generalization error",2006,"Journal of Machine Learning Research","jmlr.org","http://www.jmlr.org/papers/v7/sugiyama06a.html","https://scholar.google.com/scholar?cites=2024411728168739568&as_sdt=5,33&sciodt=0,33&hl=en&num=20",380,"2017-06-15","","","","",0,0,0,0,105
105,"D Nguyen, NA Smith, CP Rosé","Author age prediction from text using linear regression",2011,"Proceedings of the 5th ACL-HLT …","dl.acm.org","http://dl.acm.org/citation.cfm?id=2107651","https://scholar.google.com/scholar?cites=14805729407605667722&as_sdt=5,33&sciodt=0,33&hl=en&num=20",404,"2017-06-15","","","","",0,0,0,0,105
105,"RM Royall","Linear regression models in finite population sampling theory",1971,"Foundations of statistical inference","Toronto: Holt, Rinehart, and Winston","","https://scholar.google.com/scholar?cites=2701951229693502026&as_sdt=5,33&sciodt=0,33&hl=en&num=20",429,"2017-06-15","CITATION","","","",0,0,0,0,105
104,"MS Yang, TS Lin","Fuzzy least-squares linear regression analysis for fuzzy input–output data",2002,"Fuzzy Sets and Systems","Elsevier","http://www.sciencedirect.com/science/article/pii/S0165011401000665","https://scholar.google.com/scholar?cites=14903182691989326223&as_sdt=5,33&sciodt=0,33&hl=en&num=20",179,"2017-06-15","","","","",0,0,0,0,104
104,"P D'Urso, T Gastaldi","A least-squares approach to fuzzy linear regression analysis",2000,"Computational Statistics & Data Analysis","Elsevier","http://www.sciencedirect.com/science/article/pii/S0167947399001097","https://scholar.google.com/scholar?cites=2623219357501239712&as_sdt=5,33&sciodt=0,33&hl=en&num=20",301,"2017-06-15","","","","",0,0,0,0,104
103,"IR James, PJ Smith","Consistency results for linear regression with censored data",1984,"The Annals of Statistics","projecteuclid.org","http://projecteuclid.org/euclid.aos/1176346507","https://scholar.google.com/scholar?cites=16261941458179183573&as_sdt=5,33&sciodt=0,33&hl=en&num=20",312,"2017-06-15","","","","",0,0,0,0,103
103,"BB DAVIES, B Mutton","The effect of errors in the independent variables in linear regression",1975,"Biometrika","Biometrika Trust","http://biomet.oxfordjournals.org/content/62/2/383.short","https://scholar.google.com/scholar?cites=4108463566426537709&as_sdt=5,33&sciodt=0,33&hl=en&num=20",318,"2017-06-15","","","","",0,0,0,0,103
103,"WA Fuller, JNK Rao","Estimation for a linear regression model with unknown diagonal covariance matrix",1978,"The Annals of Statistics","JSTOR","http://www.jstor.org/stable/2958615","https://scholar.google.com/scholar?cites=14682156733548172044&as_sdt=5,33&sciodt=0,33&hl=en&num=20",326,"2017-06-15","","","","",0,0,0,0,103
103,"M Halperin","On inverse estimation in linear regression",1970,"Technometrics","Taylor & Francis","http://www.tandfonline.com/doi/abs/10.1080/00401706.1970.10488723","https://scholar.google.com/scholar?cites=16989313576597654480&as_sdt=5,33&sciodt=0,33&hl=en&num=20",372,"2017-06-15","","","","",0,0,0,0,103
103,"GP Ayers","Comment on regression analysis of air quality data",2001,"Atmospheric Environment","Elsevier","http://www.sciencedirect.com/science/article/pii/S1352231000005276","https://scholar.google.com/scholar?cites=10528112540280024292&as_sdt=5,33&sciodt=0,33&hl=en&num=20",645,"2017-06-15","","","","",0,0,0,0,103
102,"WA Wallis","Tolerance intervals for linear regression",1951,"Second Berkeley Symposium on …","digitalassets.lib.berkeley.edu","http://digitalassets.lib.berkeley.edu/math/ucb/text/math_s2_article-04.pdf","https://scholar.google.com/scholar?cites=6888711540838660705&as_sdt=5,33&sciodt=0,33&hl=en&num=20",316,"2017-06-15","PDF","","","",0,0,0,0,102
102,"W Nelson, GJ Hahn","Linear Estimation of a Regression Relationship from Censored Data Part I—Simple Methods and Their Application",1972,"Technometrics","Taylor & Francis","http://www.tandfonline.com/doi/abs/10.1080/00401706.1972.10488912","https://scholar.google.com/scholar?cites=5938309787398497325&as_sdt=5,33&sciodt=0,33&hl=en&num=20",375,"2017-06-15","","","","",0,0,0,0,102
102,"A Goia, C May, G Fusai","Functional clustering and linear regression for peak load forecasting",2010,"International Journal of Forecasting","Elsevier","http://www.sciencedirect.com/science/article/pii/S0169207009000879","https://scholar.google.com/scholar?cites=3891658243270385708&as_sdt=5,33&sciodt=0,33&hl=en&num=20",378,"2017-06-15","","","","",0,0,0,0,102
102,"HK Elminir, YA Azzam, FI Younes","Prediction of hourly and daily diffuse fraction using neural network, as compared to linear regression models",2007,"Energy","Elsevier","http://www.sciencedirect.com/science/article/pii/S0360544206002969","https://scholar.google.com/scholar?cites=11422867598138999327&as_sdt=5,33&sciodt=0,33&hl=en&num=20",396,"2017-06-15","","","","",0,0,0,0,102
102,"X Meng, MW Mahoney","Low-distortion subspace embeddings in input-sparsity time and applications to robust linear regression",2013,"Proceedings of the forty-fifth annual ACM …","dl.acm.org","http://dl.acm.org/citation.cfm?id=2488621","https://scholar.google.com/scholar?cites=853522642891755851&as_sdt=5,33&sciodt=0,33&hl=en&num=20",457,"2017-06-15","","","","",0,0,0,0,102
