Cites,Authors,Title,Year,Source,Publisher,ArticleURL,CitesURL,GSRank,QueryDate,Type,DOI,ISSN,CitationURL,Volume,Issue,StartPage,EndPage,ECC
86,"J Zeng, W Qiao","Short-term solar power prediction using a support vector machine",2013,"Renewable Energy","Elsevier","http://www.sciencedirect.com/science/article/pii/S0960148112006465","https://scholar.google.com/scholar?cites=18144268087148442151&as_sdt=5,33&sciodt=0,33&hl=en&num=20",462,"2017-06-15","","","","",0,0,0,0,86
86,"MS Tehrany, B Pradhan, MN Jebur","Flood susceptibility mapping using a novel ensemble weights-of-evidence and support vector machine models in GIS",2014,"Journal of Hydrology","Elsevier","http://www.sciencedirect.com/science/article/pii/S0022169414001826","https://scholar.google.com/scholar?cites=16879165142924015357&as_sdt=5,33&sciodt=0,33&hl=en&num=20",584,"2017-06-15","","","","",0,0,0,0,86
85,"L Hao, PL Lewin","Partial discharge source discrimination using a support vector machine",2010,"IEEE Transactions on Dielectrics and …","ieeexplore.ieee.org","http://ieeexplore.ieee.org/abstract/document/5412017/","https://scholar.google.com/scholar?cites=15529803878112866281&as_sdt=5,33&sciodt=0,33&hl=en&num=20",381,"2017-06-15","","","","",0,0,0,0,85
85,"S Chen, W Wang, H Van Zuylen","Construct support vector machine ensemble to detect traffic incident",2009,"Expert systems with applications","Elsevier","http://www.sciencedirect.com/science/article/pii/S0957417409001602","https://scholar.google.com/scholar?cites=9882725437477215125&as_sdt=5,33&sciodt=0,33&hl=en&num=20",428,"2017-06-15","","","","",0,0,0,0,85
84,"CW Yap, CZ Cai, Y Xue, YZ Chen","Prediction of torsade-causing potential of drugs by support vector machine approach",2004,"Toxicological Sciences","Soc Toxicology","http://toxsci.oxfordjournals.org/content/79/1/170.short","https://scholar.google.com/scholar?cites=9218173252880008480&as_sdt=5,33&sciodt=0,33&hl=en&num=20",367,"2017-06-15","","","","",0,0,0,0,84
84,"N Acır","A support vector machine classifier algorithm based on a perturbation method and its application to ECG beat recognition systems",2006,"Expert Systems with Applications","Elsevier","http://www.sciencedirect.com/science/article/pii/S0957417405001995","https://scholar.google.com/scholar?cites=5256043738670765793&as_sdt=5,33&sciodt=0,33&hl=en&num=20",375,"2017-06-15","","","","",0,0,0,0,84
84,"XY Wang, T Wang, J Bu","Color image segmentation using pixel wise support vector machine classification",2011,"Pattern Recognition","Elsevier","http://www.sciencedirect.com/science/article/pii/S0031320310003948","https://scholar.google.com/scholar?cites=6922956282559091045&as_sdt=5,33&sciodt=0,33&hl=en&num=20",400,"2017-06-15","","","","",0,0,0,0,84
84,"CX Xue, RS Zhang, HX Liu, XJ Yao…","QSAR models for the prediction of binding affinities to human serum albumin using the heuristic method and a support vector machine",2004,"Journal of chemical …","ACS Publications","http://pubs.acs.org/doi/abs/10.1021/ci049820b","https://scholar.google.com/scholar?cites=4075556537553810711&as_sdt=5,33&sciodt=0,33&hl=en&num=20",435,"2017-06-15","","","","",0,0,0,0,84
84,"D Shifei, Q Bingjuan, T Hongyan","An overview on theory and algorithm of support vector machines",2011,"Journal of University of Electronic …","en.cnki.com.cn","http://en.cnki.com.cn/Article_en/CJFDTOTAL-DKDX201101003.htm","https://scholar.google.com/scholar?cites=14284512005651525207&as_sdt=5,33&sciodt=0,33&hl=en&num=20",486,"2017-06-15","","","","",0,0,0,0,84
83,"YD Cai, KY Feng, YX Li, KC Chou","Support vector machine for predicting α-turn types",2003,"Peptides","Elsevier","http://www.sciencedirect.com/science/article/pii/S0196978103001001","https://scholar.google.com/scholar?cites=5357117571621495106&as_sdt=5,33&sciodt=0,33&hl=en&num=20",193,"2017-06-15","","","","",0,0,0,0,83
83,"SA Mulay, PR Devale, GV Garje","Intrusion detection system using support vector machine and decision tree",2010,"International Journal of …","bvucoepune.edu.in","http://www.bvucoepune.edu.in/pdf's/Research%20and%20Publication/Research%20Publications_2010-11/International_Journal_2010-2011/Intrusion%20Detection%20System.pdf","https://scholar.google.com/scholar?cites=1265260916187348952&as_sdt=5,33&sciodt=0,33&hl=en&num=20",255,"2017-06-15","PDF","","","",0,0,0,0,83
83,"J Zhou, KL Chan, VFH Chong…","Extraction of brain tumor from MR images using one-class support vector machine",2006,"… in Medicine and …","ieeexplore.ieee.org","http://ieeexplore.ieee.org/abstract/document/1615965/","https://scholar.google.com/scholar?cites=11897973792072369470&as_sdt=5,33&sciodt=0,33&hl=en&num=20",264,"2017-06-15","","","","",0,0,0,0,83
83,"J Ng, S Gong","Multi-view face detection and pose estimation using a composite support vector machine across the view sphere",1999,"Recognition, Analysis, and Tracking of Faces …","ieeexplore.ieee.org","http://ieeexplore.ieee.org/abstract/document/799218/","https://scholar.google.com/scholar?cites=9295043178527843452&as_sdt=5,33&sciodt=0,33&hl=en&num=20",320,"2017-06-15","","","","",0,0,0,0,83
83,"H Cheng, N Zheng, J Qin","Pedestrian detection using sparse gabor filter and support vector machine",2005,"Intelligent Vehicles Symposium, …","ieeexplore.ieee.org","http://ieeexplore.ieee.org/abstract/document/1505166/","https://scholar.google.com/scholar?cites=14283095120520269306&as_sdt=5,33&sciodt=0,33&hl=en&num=20",337,"2017-06-15","","","","",0,0,0,0,83
83,"J Sun, M Rahman, YS Wong, GS Hong","Multiclassification of tool wear with support vector machine by manufacturing loss consideration",2004,"International Journal of Machine …","Elsevier","http://www.sciencedirect.com/science/article/pii/S0890695504000859","https://scholar.google.com/scholar?cites=7953497413107892094&as_sdt=5,33&sciodt=0,33&hl=en&num=20",396,"2017-06-15","","","","",0,0,0,0,83
83,"J Mourao-Miranda, A Reinders…","Individualized prediction of illness course at the first psychotic episode: a support vector machine MRI study",2012,"Psychological …","Cambridge Univ Press","http://journals.cambridge.org/article_S0033291711002005","https://scholar.google.com/scholar?cites=10280160708556338930&as_sdt=5,33&sciodt=0,33&hl=en&num=20",402,"2017-06-15","PDF","","","",0,0,0,0,83
83,"R Ramesh, MA Mannan, AN Poo, SS Keerthi","Thermal error measurement and modelling in machine tools. Part II. Hybrid Bayesian Network—support vector machine model",2003,"… Journal of Machine Tools …","Elsevier","http://www.sciencedirect.com/science/article/pii/S089069550200264X","https://scholar.google.com/scholar?cites=4945350413437614089&as_sdt=5,33&sciodt=0,33&hl=en&num=20",420,"2017-06-15","","","","",0,0,0,0,83
83,"X Chen, J Yang, Q Ye, J Liang","Recursive projection twin support vector machine via within-class variance minimization",2011,"Pattern Recognition","Elsevier","http://www.sciencedirect.com/science/article/pii/S0031320311000860","https://scholar.google.com/scholar?cites=12438173748492861795&as_sdt=5,33&sciodt=0,33&hl=en&num=20",458,"2017-06-15","","","","",0,0,0,0,83
83,"GF Lin, GR Chen, PY Huang, YC Chou","Support vector machine-based models for hourly reservoir inflow forecasting during typhoon-warning periods",2009,"Journal of Hydrology","Elsevier","http://www.sciencedirect.com/science/article/pii/S0022169409002121","https://scholar.google.com/scholar?cites=12358783544347707203&as_sdt=5,33&sciodt=0,33&hl=en&num=20",463,"2017-06-15","","","","",0,0,0,0,83
82,"HC Kim, S Pang, HM Je, D Kim…","Pattern classification using support vector machine ensemble",2002,"… 2002. Proceedings. 16th …","ieeexplore.ieee.org","http://ieeexplore.ieee.org/abstract/document/1048262/","https://scholar.google.com/scholar?cites=15958179095867968333&as_sdt=5,33&sciodt=0,33&hl=en&num=20",263,"2017-06-15","","","","",0,0,0,0,82
82,"T Eitrich, B Lang","Efficient optimization of support vector machine learning parameters for unbalanced datasets",2006,"Journal of computational and applied mathematics","Elsevier","http://www.sciencedirect.com/science/article/pii/S0377042705005856","https://scholar.google.com/scholar?cites=313155437502786655&as_sdt=5,33&sciodt=0,33&hl=en&num=20",395,"2017-06-15","HTML","","","",0,0,0,0,82
82,"M Fuentes, S Garcia-Salicetti…","On line signature verification: Fusion of a Hidden Markov Model and a neural network via a support vector machine",2002,"Frontiers in Handwriting …","ieeexplore.ieee.org","http://ieeexplore.ieee.org/abstract/document/1030918/","https://scholar.google.com/scholar?cites=6601137762147108918&as_sdt=5,33&sciodt=0,33&hl=en&num=20",407,"2017-06-15","","","","",0,0,0,0,82
82,"TB Meier, AS Desphande, S Vergun, VA Nair, J Song…","Support vector machine classification and characterization of age-related reorganization of functional brain networks",2012,"Neuroimage","Elsevier","http://www.sciencedirect.com/science/article/pii/S1053811911014546","https://scholar.google.com/scholar?cites=14399102799480259650&as_sdt=5,33&sciodt=0,33&hl=en&num=20",484,"2017-06-15","","","","",0,0,0,0,82
82,"S Haller, D Nguyen, C Rodriguez…","Individual prediction of cognitive decline in mild cognitive impairment using support vector machine-based analysis of diffusion tensor imaging data",2010,"Journal of …","content.iospress.com","http://content.iospress.com/articles/journal-of-alzheimers-disease/jad100840","https://scholar.google.com/scholar?cites=6767648053878576590&as_sdt=5,33&sciodt=0,33&hl=en&num=20",500,"2017-06-15","","","","",0,0,0,0,82
81,"D Zhao, M Wang, J ZHANG, X WANG","A support vector machine approach for short term load forecasting [J]",2002,"Proceedings of the CSEE","en.cnki.com.cn","http://en.cnki.com.cn/Article_en/CJFDTOTAL-ZGDC200204004.htm","https://scholar.google.com/scholar?cites=17242203826395096800&as_sdt=5,33&sciodt=0,33&hl=en&num=20",164,"2017-06-15","","","","",0,0,0,0,81
81,"Q Wu, DX Zhou","Analysis of support vector machine classification.",2006,"Journal of Computational Analysis & …","search.ebscohost.com","http://search.ebscohost.com/login.aspx?direct=true&profile=ehost&scope=site&authtype=crawler&jrnl=15211398&AN=21501445&h=TCxIfFvRzglnfZLpFSMNf8nXXoG25skZ1qHwM1LyOoWl7n1jYVoNSGXMd90NZvDIRYs8EOlmotBFccDH9kDZDg%3D%3D&crl=c","https://scholar.google.com/scholar?cites=12313976152850526275&as_sdt=5,33&sciodt=0,33&hl=en&num=20",365,"2017-06-15","","","","",0,0,0,0,81
81,"E Pourbasheer, S Riahi, MR Ganjali…","Application of genetic algorithm-support vector machine (GA-SVM) for prediction of BK-channels activity",2009,"European journal of …","Elsevier","http://www.sciencedirect.com/science/article/pii/S0223523409004383","https://scholar.google.com/scholar?cites=18206868631033659043&as_sdt=5,33&sciodt=0,33&hl=en&num=20",383,"2017-06-15","","","","",0,0,0,0,81
81,"JT Jeng","Hybrid approach of selecting hyperparameters of support vector machine for regression",2005,"IEEE Transactions on Systems, Man, and …","ieeexplore.ieee.org","http://ieeexplore.ieee.org/abstract/document/1634661/","https://scholar.google.com/scholar?cites=14235858864746234114&as_sdt=5,33&sciodt=0,33&hl=en&num=20",386,"2017-06-15","","","","",0,0,0,0,81
81,"Z Qi, Y Tian, Y Shi","Structural twin support vector machine for classification",2013,"Knowledge-Based Systems","Elsevier","http://www.sciencedirect.com/science/article/pii/S0950705113000208","https://scholar.google.com/scholar?cites=3441327026457149763&as_sdt=5,33&sciodt=0,33&hl=en&num=20",389,"2017-06-15","","","","",0,0,0,0,81
81,"D Wu, H Yang, X Chen, Y He, X Li","Application of image texture for the sorting of tea categories using multi-spectral imaging technique and support vector machine",2008,"Journal of Food Engineering","Elsevier","http://www.sciencedirect.com/science/article/pii/S0260877408001222","https://scholar.google.com/scholar?cites=7456999161805053233&as_sdt=5,33&sciodt=0,33&hl=en&num=20",409,"2017-06-15","","","","",0,0,0,0,81
81,"B Zheng, SW Yoon, SS Lam","Breast cancer diagnosis based on feature extraction using a hybrid of K-means and support vector machine algorithms",2014,"Expert Systems with Applications","Elsevier","http://www.sciencedirect.com/science/article/pii/S0957417413006659","https://scholar.google.com/scholar?cites=11509503650375322010&as_sdt=5,33&sciodt=0,33&hl=en&num=20",454,"2017-06-15","","","","",0,0,0,0,81
81,"H Yamada, T Kudo, Y Matsumoto","Japanese named entity extraction using support vector machine",2002,"Transactions of Information Processing Society of …","","","https://scholar.google.com/scholar?cites=9337136964854432656&as_sdt=5,33&sciodt=0,33&hl=en&num=20",471,"2017-06-15","CITATION","","","",0,0,0,0,81
80,"YF Sun, XD Fan, YD Li","Identifying splicing sites in eukaryotic RNA: support vector machine approach",2003,"Computers in biology and medicine","Elsevier","http://www.sciencedirect.com/science/article/pii/S0010482502000574","https://scholar.google.com/scholar?cites=9679611667941978010&as_sdt=5,33&sciodt=0,33&hl=en&num=20",377,"2017-06-15","","","","",0,0,0,0,80
80,"G Xia, W Jin","Model of customer churn prediction on support vector machine",2008,"Systems Engineering-Theory & Practice","Elsevier","http://www.sciencedirect.com/science/article/pii/S187486510960003X","https://scholar.google.com/scholar?cites=16714569026156712457&as_sdt=5,33&sciodt=0,33&hl=en&num=20",378,"2017-06-15","","","","",0,0,0,0,80
80,"J Zhang, Y Wang","A rough margin based support vector machine",2008,"Information Sciences","Elsevier","http://www.sciencedirect.com/science/article/pii/S0020025507005853","https://scholar.google.com/scholar?cites=11554510044072172418&as_sdt=5,33&sciodt=0,33&hl=en&num=20",387,"2017-06-15","","","","",0,0,0,0,80
80,"MH Fatemi, S Gharaghani","A novel QSAR model for prediction of apoptosis-inducing activity of 4-aryl-4-H-chromenes based on support vector machine",2007,"Bioorganic & medicinal chemistry","Elsevier","http://www.sciencedirect.com/science/article/pii/S0968089607007675","https://scholar.google.com/scholar?cites=10009411604198383442&as_sdt=5,33&sciodt=0,33&hl=en&num=20",413,"2017-06-15","","","","",0,0,0,0,80
80,"CK Oh, H Sohn","Damage diagnosis under environmental and operational variations using unsupervised support vector machine",2009,"Journal of Sound and Vibration","Elsevier","http://www.sciencedirect.com/science/article/pii/S0022460X09002491","https://scholar.google.com/scholar?cites=11962559144515308460&as_sdt=5,33&sciodt=0,33&hl=en&num=20",446,"2017-06-15","","","","",0,0,0,0,80
79,"M Dong, YY Meng, CX Xu, Z Yan","Fault Diagnosis model for power transformer based on support vector machine and dissolved gas analysis [J]",2003,"Proceedings of the Csee","en.cnki.com.cn","http://en.cnki.com.cn/Article_en/CJFDTOTAL-ZGDC200307018.htm","https://scholar.google.com/scholar?cites=10129046633115854839&as_sdt=5,33&sciodt=0,33&hl=en&num=20",230,"2017-06-15","","","","",0,0,0,0,79
79,"V Wan, S Renals","SVMSVM: Support vector machine speaker verification methodology",2003,"… 2003. Proceedings.(ICASSP'03). 2003 IEEE …","ieeexplore.ieee.org","http://ieeexplore.ieee.org/abstract/document/1202334/","https://scholar.google.com/scholar?cites=18376587031675670430&as_sdt=5,33&sciodt=0,33&hl=en&num=20",327,"2017-06-15","","","","",0,0,0,0,79
79,"C Sanchez-Hernandez, DS Boyd, GM Foody","Mapping specific habitats from remotely sensed imagery: support vector machine and support vector data description based classification of coastal saltmarsh habitats",2007,"Ecological informatics","Elsevier","http://www.sciencedirect.com/science/article/pii/S157495410700026X","https://scholar.google.com/scholar?cites=14513899542949709793&as_sdt=5,33&sciodt=0,33&hl=en&num=20",380,"2017-06-15","","","","",0,0,0,0,79
79,"S Ismail, A Shabri, R Samsudin","A hybrid model of self-organizing maps (SOM) and least square support vector machine (LSSVM) for time-series forecasting",2011,"Expert Systems with Applications","Elsevier","http://www.sciencedirect.com/science/article/pii/S0957417411003137","https://scholar.google.com/scholar?cites=1184261865795691790&as_sdt=5,33&sciodt=0,33&hl=en&num=20",391,"2017-06-15","","","","",0,0,0,0,79
79,"Q Li, FS Jørgensen, T Oprea, S Brunak…","hERG classification model based on a combination of support vector machine method and GRIND descriptors",2008,"Molecular …","ACS Publications","http://pubs.acs.org/doi/abs/10.1021/mp700124e","https://scholar.google.com/scholar?cites=15232551602736497776&as_sdt=5,33&sciodt=0,33&hl=en&num=20",626,"2017-06-15","","","","",0,0,0,0,79
78,"M Tobita, T Nishikawa, R Nagashima","A discriminant model constructed by the support vector machine method for HERG potassium channel inhibitors",2005,"Bioorganic & medicinal chemistry …","Elsevier","http://www.sciencedirect.com/science/article/pii/S0960894X05004038","https://scholar.google.com/scholar?cites=8579855412789106395&as_sdt=5,33&sciodt=0,33&hl=en&num=20",379,"2017-06-15","","","","",0,0,0,0,78
78,"S Osowski, R Siroic, T Markiewicz…","Application of support vector machine and genetic algorithm for improved blood cell recognition",2009,"IEEE Transactions on …","ieeexplore.ieee.org","http://ieeexplore.ieee.org/abstract/document/4671087/","https://scholar.google.com/scholar?cites=16242241767675325732&as_sdt=5,33&sciodt=0,33&hl=en&num=20",442,"2017-06-15","","","","",0,0,0,0,78
78,"Y Zhang, Z Dong, S Wang, G Ji, J Yang","… resonance (MR) brain images via discrete wavelet packet transform with Tsallis entropy and generalized eigenvalue proximal support vector machine ( …",2015,"Entropy","mdpi.com","http://www.mdpi.com/1099-4300/17/4/1795/htm","https://scholar.google.com/scholar?cites=9398798029294024927&as_sdt=5,33&sciodt=0,33&hl=en&num=20",639,"2017-06-15","HTML","","","",0,0,0,0,78
78,"S Chen, SR Gunn, CJ Harris","The relevance vector machine technique for channel equalization application",2001,"IEEE Transactions on Neural …","ieeexplore.ieee.org","http://ieeexplore.ieee.org/abstract/document/963792/","https://scholar.google.com/scholar?cites=3376720797316329100&as_sdt=5,33&sciodt=0,33&hl=en&num=20",959,"2017-06-15","","","","",0,0,0,0,78
77,"YS Chen, GP Wang, SH Dong","A progressive transductive inference algorithm based on support vector machine",2003,"Journal of Software","en.cnki.com.cn","http://en.cnki.com.cn/Article_en/CJFDTOTAL-RJXB200303024.htm","https://scholar.google.com/scholar?cites=7184643892072485869&as_sdt=5,33&sciodt=0,33&hl=en&num=20",273,"2017-06-15","","","","",0,0,0,0,77
77,"İ Babaoglu, O Findik, E Ülker","… of feature selection models utilizing binary particle swarm optimization and genetic algorithm in determining coronary artery disease using support vector machine",2010,"Expert Systems with Applications","Elsevier","http://www.sciencedirect.com/science/article/pii/S0957417409008458","https://scholar.google.com/scholar?cites=13877925544725422021&as_sdt=5,33&sciodt=0,33&hl=en&num=20",401,"2017-06-15","","","","",0,0,0,0,77
77,"S Fei, MJ Wang, Y Miao, J Tu, C Liu","Particle swarm optimization-based support vector machine for forecasting dissolved gases content in power transformer oil",2009,"Energy Conversion and Management","Elsevier","http://www.sciencedirect.com/science/article/pii/S0196890409000569","https://scholar.google.com/scholar?cites=3410814274107443157&as_sdt=5,33&sciodt=0,33&hl=en&num=20",403,"2017-06-15","","","","",0,0,0,0,77
77,"SL Lo, CZ Cai, YZ Chen, M Chung","Effect of training datasets on support vector machine prediction of protein‐protein interactions",2005,"Proteomics","Wiley Online Library","http://onlinelibrary.wiley.com/doi/10.1002/pmic.200401118/full","https://scholar.google.com/scholar?cites=12751777340305311813&as_sdt=5,33&sciodt=0,33&hl=en&num=20",424,"2017-06-15","","","","",0,0,0,0,77
77,"J Bi, Y Chen, JZ Wang","A sparse support vector machine approach to region-based image categorization",2005,"Computer Vision and Pattern …","ieeexplore.ieee.org","http://ieeexplore.ieee.org/abstract/document/1467392/","https://scholar.google.com/scholar?cites=17963902981457571481&as_sdt=5,33&sciodt=0,33&hl=en&num=20",430,"2017-06-15","","","","",0,0,0,0,77
77,"M Pal","Support vector machine‐based feature selection for land cover classification: a case study with DAIS hyperspectral data",2006,"International Journal of Remote Sensing","Taylor & Francis","http://www.tandfonline.com/doi/abs/10.1080/01431160500242515","https://scholar.google.com/scholar?cites=17245775647498570331&as_sdt=5,33&sciodt=0,33&hl=en&num=20",448,"2017-06-15","","","","",0,0,0,0,77
77,"L Zhuo, J Zheng, X Li, F Wang…","A genetic algorithm based wrapper feature selection method for classification of hyperspectral images using support vector machine",2008,"… 2008 and Joint …","proceedings.spiedigitallibrary.org","http://proceedings.spiedigitallibrary.org/proceeding.aspx?articleid=803366","https://scholar.google.com/scholar?cites=568208335226028130&as_sdt=5,33&sciodt=0,33&hl=en&num=20",449,"2017-06-15","","","","",0,0,0,0,77
76,"HC Kim, S Pang, HM Je, D Kim, SY Bang","Support vector machine ensemble with bagging",2002,"… recognition with support vector …","Springer","http://link.springer.com/chapter/10.1007/3-540-45665-1_31","https://scholar.google.com/scholar?cites=3872639457746689601&as_sdt=5,33&sciodt=0,33&hl=en&num=20",345,"2017-06-15","","","","",0,0,0,0,76
76,"U Norinder","Support vector machine models in drug design: applications to drug transport processes and QSAR using simplex optimisations and variable selection",2003,"Neurocomputing","Elsevier","http://www.sciencedirect.com/science/article/pii/S0925231203003746","https://scholar.google.com/scholar?cites=13468131485524077520&as_sdt=5,33&sciodt=0,33&hl=en&num=20",369,"2017-06-15","","","","",0,0,0,0,76
76,"M Bhasin, EL Reinherz…","Recognition and classification of histones using support vector machine",2006,"Journal of Computational …","online.liebertpub.com","http://online.liebertpub.com/doi/abs/10.1089/cmb.2006.13.102","https://scholar.google.com/scholar?cites=15037278742739132376&as_sdt=5,33&sciodt=0,33&hl=en&num=20",405,"2017-06-15","","","","",0,0,0,0,76
76,"P Samui","Support vector machine applied to settlement of shallow foundations on cohesionless soils",2008,"Computers and Geotechnics","Elsevier","http://www.sciencedirect.com/science/article/pii/S0266352X07000791","https://scholar.google.com/scholar?cites=9018696172269084635&as_sdt=5,33&sciodt=0,33&hl=en&num=20",412,"2017-06-15","","","","",0,0,0,0,76
76,"A Ekbal, S Bandyopadhyay","Bengali Named Entity Recognition Using Support Vector Machine.",2008,"IJCNLP","anthology.aclweb.org","http://www.anthology.aclweb.org/I/I08/I08-5.pdf#page=61","https://scholar.google.com/scholar?cites=9878431876335647805&as_sdt=5,33&sciodt=0,33&hl=en&num=20",414,"2017-06-15","PDF","","","",0,0,0,0,76
76,"B Han, LS Davis","Density-based multifeature background subtraction with support vector machine",2012,"… on Pattern Analysis and Machine …","ieeexplore.ieee.org","http://ieeexplore.ieee.org/abstract/document/6104064/","https://scholar.google.com/scholar?cites=3334789073620099729&as_sdt=5,33&sciodt=0,33&hl=en&num=20",455,"2017-06-15","","","","",0,0,0,0,76
76,"Y Li, PP Wen","Clustering technique-based least square support vector machine for EEG signal classification",2011,"Computer methods and programs in biomedicine","Elsevier","http://www.sciencedirect.com/science/article/pii/S0169260710002907","https://scholar.google.com/scholar?cites=17005883081787075435&as_sdt=5,33&sciodt=0,33&hl=en&num=20",480,"2017-06-15","","","","",0,0,0,0,76
76,"K Bacha, S Souahlia, M Gossa","Power transformer fault diagnosis based on dissolved gas analysis by support vector machine",2012,"Electric power systems research","Elsevier","http://www.sciencedirect.com/science/article/pii/S0378779611002288","https://scholar.google.com/scholar?cites=1611658241341581273&as_sdt=5,33&sciodt=0,33&hl=en&num=20",491,"2017-06-15","","","","",0,0,0,0,76
76,"MM Rahman, BC Desai, P Bhattacharya","Medical image retrieval with probabilistic multi-class support vector machine classifiers and adaptive similarity fusion",2008,"Computerized Medical Imaging …","Elsevier","http://www.sciencedirect.com/science/article/pii/S0895611107001383","https://scholar.google.com/scholar?cites=2552279220959165348&as_sdt=5,33&sciodt=0,33&hl=en&num=20",518,"2017-06-15","","","","",0,0,0,0,76
76,"J Huang, X Hu, X Geng","An intelligent fault diagnosis method of high voltage circuit breaker based on improved EMD energy entropy and multi-class support vector machine",2011,"Electric Power Systems Research","Elsevier","http://www.sciencedirect.com/science/article/pii/S0378779610002646","https://scholar.google.com/scholar?cites=17019507974758427624&as_sdt=5,33&sciodt=0,33&hl=en&num=20",523,"2017-06-15","","","","",0,0,0,0,76
76,"T Hou, J Wang, Y Li","ADME evaluation in drug discovery. 8. The prediction of human intestinal absorption by a support vector machine",2007,"Journal of chemical information and …","ACS Publications","http://pubs.acs.org/doi/abs/10.1021/ci7002076","https://scholar.google.com/scholar?cites=2576343064842574436&as_sdt=5,33&sciodt=0,33&hl=en&num=20",552,"2017-06-15","","","","",0,0,0,0,76
76,"CH Li, BC Kuo, CT Lin…","A spatial–contextual support vector machine for remotely sensed image classification",2012,"IEEE Transactions on …","ieeexplore.ieee.org","http://ieeexplore.ieee.org/abstract/document/6003774/","https://scholar.google.com/scholar?cites=8160168738868087342&as_sdt=5,33&sciodt=0,33&hl=en&num=20",580,"2017-06-15","","","","",0,0,0,0,76
75,"E Özgündüz, T Şentürk…","Off-line signature verification and recognition by support vector machine",2005,"… Conference, 2005 13th …","ieeexplore.ieee.org","http://ieeexplore.ieee.org/abstract/document/7078479/","https://scholar.google.com/scholar?cites=16035452201136427839&as_sdt=5,33&sciodt=0,33&hl=en&num=20",334,"2017-06-15","","","","",0,0,0,0,75
