Cites,Authors,Title,Year,Source,Publisher,ArticleURL,CitesURL,GSRank,QueryDate,Type,DOI,ISSN,CitationURL,Volume,Issue,StartPage,EndPage,ECC
59,"GS Hu, J Xie, FF Zhu","Classification of power quality disturbances using wavelet and fuzzy support vector machines",2005,"Machine Learning and Cybernetics, …","ieeexplore.ieee.org","http://ieeexplore.ieee.org/abstract/document/1527633/","https://scholar.google.com/scholar?cites=6339304241037913424&as_sdt=5,33&sciodt=0,33&hl=en&num=20",888,"2017-06-15","","","","",0,0,0,0,59
59,"A Soualhi, K Medjaher…","Bearing health monitoring based on Hilbert–Huang transform, support vector machine, and regression",2015,"IEEE Transactions on …","ieeexplore.ieee.org","http://ieeexplore.ieee.org/abstract/document/6847199/","https://scholar.google.com/scholar?cites=12526862265585976137&as_sdt=5,33&sciodt=0,33&hl=en&num=20",889,"2017-06-15","","","","",0,0,0,0,59
58,"AR Ahmad, M Khalia, C Viard-Gaudin…","Online handwriting recognition using support vector machine",2004,"TENCON 2004. 2004 …","ieeexplore.ieee.org","http://ieeexplore.ieee.org/abstract/document/1414419/","https://scholar.google.com/scholar?cites=7665248917358762023&as_sdt=5,33&sciodt=0,33&hl=en&num=20",419,"2017-06-15","","","","",0,0,0,0,58
58,"CJ Hsieh, S Si, I Dhillon","A divide-and-conquer solver for kernel support vector machines",2014,"International Conference on Machine Learning","jmlr.org","http://www.jmlr.org/proceedings/papers/v32/hsieha14.html","https://scholar.google.com/scholar?cites=17649357951714509227&as_sdt=5,33&sciodt=0,33&hl=en&num=20",504,"2017-06-15","HTML","","","",0,0,0,0,58
58,"D Lee, J Lee","Equilibrium-based support vector machine for semisupervised classification",2007,"IEEE Transactions on Neural Networks","ieeexplore.ieee.org","http://ieeexplore.ieee.org/abstract/document/4118268/","https://scholar.google.com/scholar?cites=11699303550432710609&as_sdt=5,33&sciodt=0,33&hl=en&num=20",522,"2017-06-15","","","","",0,0,0,0,58
58,"KC Chen, CYC Chen","Stroke prevention by traditional Chinese medicine? A genetic algorithm, support vector machine and molecular dynamics approach",2011,"Soft Matter","pubs.rsc.org","http://pubs.rsc.org/en/content/articlehtml/2011/sm/c0sm01548b","https://scholar.google.com/scholar?cites=1974163103234627604&as_sdt=5,33&sciodt=0,33&hl=en&num=20",593,"2017-06-15","","","","",0,0,0,0,58
58,"W Cui, X Yan","Adaptive weighted least square support vector machine regression integrated with outlier detection and its application in QSAR",2009,"Chemometrics and Intelligent Laboratory Systems","Elsevier","http://www.sciencedirect.com/science/article/pii/S0169743909001208","https://scholar.google.com/scholar?cites=17335824766227971783&as_sdt=5,33&sciodt=0,33&hl=en&num=20",597,"2017-06-15","","","","",0,0,0,0,58
58,"P Shen, Z Changjun, X Chen","Automatic speech emotion recognition using support vector machine",2011,"Electronic and Mechanical …","ieeexplore.ieee.org","http://ieeexplore.ieee.org/abstract/document/6023178/","https://scholar.google.com/scholar?cites=11075774754899704705&as_sdt=5,33&sciodt=0,33&hl=en&num=20",601,"2017-06-15","","","","",0,0,0,0,58
58,"H Zhao, S Yin","Geomechanical parameters identification by particle swarm optimization and support vector machine",2009,"Applied Mathematical Modelling","Elsevier","http://www.sciencedirect.com/science/article/pii/S0307904X09000250","https://scholar.google.com/scholar?cites=2768689986189076800&as_sdt=5,33&sciodt=0,33&hl=en&num=20",622,"2017-06-15","HTML","","","",0,0,0,0,58
58,"MM Adankon, M Cheriet, A Biem","Semisupervised least squares support vector machine",2009,"IEEE Transactions on Neural …","ieeexplore.ieee.org","http://ieeexplore.ieee.org/abstract/document/5280253/","https://scholar.google.com/scholar?cites=11452382307640114347&as_sdt=5,33&sciodt=0,33&hl=en&num=20",640,"2017-06-15","","","","",0,0,0,0,58
58,"J Tian, N Wu, J Guo, Y Fan","Prediction of amyloid fibril-forming segments based on a support vector machine",2009,"BMC bioinformatics","biomedcentral.com","https://www.biomedcentral.com/qc/1471-2105/10/S1/S45","https://scholar.google.com/scholar?cites=6820913024389467061&as_sdt=5,33&sciodt=0,33&hl=en&num=20",648,"2017-06-15","HTML","","","",0,0,0,0,58
58,"J Mashford, D De Silva, D Marney…","An approach to leak detection in pipe networks using analysis of monitored pressure values by support vector machine",2009,"Network and System …","ieeexplore.ieee.org","http://ieeexplore.ieee.org/abstract/document/5319304/","https://scholar.google.com/scholar?cites=8662939875682412349&as_sdt=5,33&sciodt=0,33&hl=en&num=20",654,"2017-06-15","","","","",0,0,0,0,58
58,"Y Sheng, PG Engström, B Lenhard","Mammalian microRNA prediction through a support vector machine model of sequence and structure",2007,"PloS one","journals.plos.org","http://journals.plos.org/plosone/article?id=10.1371/journal.pone.0000946","https://scholar.google.com/scholar?cites=3543030463297157498&as_sdt=5,33&sciodt=0,33&hl=en&num=20",672,"2017-06-15","HTML","","","",0,0,0,0,58
58,"Y Li, JTY Kwok, ZH Zhou","Cost-sensitive semi-supervised support vector machine",2010,"… of the National Conference on Artificial …","repository.ust.hk","http://repository.ust.hk/dspace/handle/1783.1/6811","https://scholar.google.com/scholar?cites=15959064476715017588&as_sdt=5,33&sciodt=0,33&hl=en&num=20",687,"2017-06-15","","","","",0,0,0,0,58
58,"Z Xu, M Dai, D Meng","Fast and efficient strategies for model selection of Gaussian support vector machine",2009,"… on Systems, Man, and Cybernetics, Part …","ieeexplore.ieee.org","http://ieeexplore.ieee.org/abstract/document/4808205/","https://scholar.google.com/scholar?cites=16061160088816203284&as_sdt=5,33&sciodt=0,33&hl=en&num=20",707,"2017-06-15","","","","",0,0,0,0,58
58,"B Yao, L Zhang, S Liang, C Zhang","SVMTriP: a method to predict antigenic epitopes using support vector machine to integrate tri-peptide similarity and propensity",2012,"PloS one","journals.plos.org","http://journals.plos.org/plosone/article?id=10.1371/journal.pone.0045152","https://scholar.google.com/scholar?cites=17609014410101206229&as_sdt=5,33&sciodt=0,33&hl=en&num=20",743,"2017-06-15","HTML","","","",0,0,0,0,58
58,"J Huang, X Hu, F Yang","Support vector machine with genetic algorithm for machinery fault diagnosis of high voltage circuit breaker",2011,"Measurement","Elsevier","http://www.sciencedirect.com/science/article/pii/S026322411100073X","https://scholar.google.com/scholar?cites=17655942078090667601&as_sdt=5,33&sciodt=0,33&hl=en&num=20",761,"2017-06-15","","","","",0,0,0,0,58
58,"J Wang, Q Shi","Short-term traffic speed forecasting hybrid model based on chaos–wavelet analysis-support vector machine theory",2013,"Transportation Research Part C: Emerging …","Elsevier","http://www.sciencedirect.com/science/article/pii/S0968090X1200109X","https://scholar.google.com/scholar?cites=14514140433187659098&as_sdt=5,33&sciodt=0,33&hl=en&num=20",813,"2017-06-15","","","","",0,0,0,0,58
58,"ZY Chen, ZP Fan, M Sun","A hierarchical multiple kernel support vector machine for customer churn prediction using longitudinal behavioral data",2012,"European Journal of operational research","Elsevier","http://www.sciencedirect.com/science/article/pii/S037722171200495X","https://scholar.google.com/scholar?cites=17805859681952071441&as_sdt=5,33&sciodt=0,33&hl=en&num=20",820,"2017-06-15","","","","",0,0,0,0,58
57,"FM Khan, MG Arnold…","Hardware-based support vector machine classification in logarithmic number systems",2005,"Circuits and Systems, …","ieeexplore.ieee.org","http://ieeexplore.ieee.org/abstract/document/1465795/","https://scholar.google.com/scholar?cites=6306135912111450702&as_sdt=5,33&sciodt=0,33&hl=en&num=20",473,"2017-06-15","","","","",0,0,0,0,57
57,"D Anguita, S Pischiutta, S Ridella…","Feed-forward support vector machine without multipliers",2006,"IEEE Transactions on …","ieeexplore.ieee.org","http://ieeexplore.ieee.org/abstract/document/1687940/","https://scholar.google.com/scholar?cites=5701669115725769470&as_sdt=5,33&sciodt=0,33&hl=en&num=20",475,"2017-06-15","","","","",0,0,0,0,57
57,"Q He, C Wu","Separating theorem of samples in Banach space for support vector machine learning",2011,"International Journal of Machine Learning and …","Springer","http://link.springer.com/article/10.1007/s13042-011-0013-4","https://scholar.google.com/scholar?cites=14374217977755137934&as_sdt=5,33&sciodt=0,33&hl=en&num=20",556,"2017-06-15","","","","",0,0,0,0,57
57,"S Choi","Detection of valvular heart disorders using wavelet packet decomposition and support vector machine",2008,"Expert Systems with Applications","Elsevier","http://www.sciencedirect.com/science/article/pii/S0957417407003958","https://scholar.google.com/scholar?cites=14326429261177494790&as_sdt=5,33&sciodt=0,33&hl=en&num=20",602,"2017-06-15","","","","",0,0,0,0,57
57,"T Liu, X Zheng, J Wang","Prediction of protein structural class for low-similarity sequences using support vector machine and PSI-BLAST profile",2010,"Biochimie","Elsevier","http://www.sciencedirect.com/science/article/pii/S0300908410002270","https://scholar.google.com/scholar?cites=13709523020601306433&as_sdt=5,33&sciodt=0,33&hl=en&num=20",629,"2017-06-15","","","","",0,0,0,0,57
57,"K Jayasurya, G Fung, S Yu, C Dehing‐Oberije…","Comparison of Bayesian network and support vector machine models for two‐year survival prediction in lung cancer patients treated with radiotherapy",2010,"Medical …","Wiley Online Library","http://onlinelibrary.wiley.com/doi/10.1118/1.3352709/full","https://scholar.google.com/scholar?cites=14705742094230873414&as_sdt=5,33&sciodt=0,33&hl=en&num=20",663,"2017-06-15","","","","",0,0,0,0,57
57,"JM Kriegl, T Arnhold, B Beck, T Fox","A support vector machine approach to classify human cytochrome P450 3A4 inhibitors",2005,"Journal of computer-aided molecular …","Springer","http://link.springer.com/article/10.1007/s10822-005-3785-3","https://scholar.google.com/scholar?cites=472577967641120362&as_sdt=5,33&sciodt=0,33&hl=en&num=20",670,"2017-06-15","","","","",0,0,0,0,57
57,"Y Kumar, ML Dewal, RS Anand","Epileptic seizure detection using DWT based fuzzy approximate entropy and support vector machine",2014,"Neurocomputing","Elsevier","http://www.sciencedirect.com/science/article/pii/S0925231214000058","https://scholar.google.com/scholar?cites=9232410324730325398&as_sdt=5,33&sciodt=0,33&hl=en&num=20",854,"2017-06-15","","","","",0,0,0,0,57
57,"MK Leong","A novel approach using pharmacophore ensemble/support vector machine (PhE/SVM) for prediction of hERG liability",2007,"Chemical research in toxicology","ACS Publications","http://pubs.acs.org/doi/abs/10.1021/tx060230c","https://scholar.google.com/scholar?cites=14382218694986364621&as_sdt=5,33&sciodt=0,33&hl=en&num=20",857,"2017-06-15","","","","",0,0,0,0,57
56,"BY Sun, DS Huang, HT Fang","Lidar signal denoising using least-squares support vector machine",2005,"IEEE Signal processing letters","ieeexplore.ieee.org","http://ieeexplore.ieee.org/abstract/document/1381460/","https://scholar.google.com/scholar?cites=13045062412571497115&as_sdt=5,33&sciodt=0,33&hl=en&num=20",427,"2017-06-15","","","","",0,0,0,0,56
56,"B Baesens, S Viaene, T Van Gestel…","An empirical assessment of kernel type performance for least squares support vector machine classifiers",2000,"… Systems and Allied …","ieeexplore.ieee.org","http://ieeexplore.ieee.org/abstract/document/885819/","https://scholar.google.com/scholar?cites=16980289649292278100&as_sdt=5,33&sciodt=0,33&hl=en&num=20",507,"2017-06-15","","","","",0,0,0,0,56
56,"LH Wang, J Liu, YF Li, HB Zhou","Predicting protein secondary structure by a support vector machine based on a new coding scheme",2004,"Genome Informatics","jstage.jst.go.jp","https://www.jstage.jst.go.jp/article/gi1990/15/2/15_2_181/_article/-char/ja/","https://scholar.google.com/scholar?cites=13301875805383690341&as_sdt=5,33&sciodt=0,33&hl=en&num=20",544,"2017-06-15","","","","",0,0,0,0,56
56,"M Savvides, R Abiantun, J Heo, S Park…","Partial & holistic face recognition on frgc-ii data using support vector machine",2006,"Computer Vision and …","ieeexplore.ieee.org","http://ieeexplore.ieee.org/abstract/document/1640488/","https://scholar.google.com/scholar?cites=77873250858452059&as_sdt=5,33&sciodt=0,33&hl=en&num=20",568,"2017-06-15","","","","",0,0,0,0,56
56,"T Sohn, JT Seo, J Moon","A study on the covert channel detection of TCP/IP header using support vector machine",2003,"International Conference on Information and …","Springer","http://link.springer.com/chapter/10.1007/978-3-540-39927-8_29","https://scholar.google.com/scholar?cites=16561022979993254949&as_sdt=5,33&sciodt=0,33&hl=en&num=20",585,"2017-06-15","","","","",0,0,0,0,56
56,"HS Yan, D Xu","An Approach to Estimating Product Design Time Based on Fuzzy $\ nu $-Support Vector Machine",2007,"IEEE transactions on Neural Networks","ieeexplore.ieee.org","http://ieeexplore.ieee.org/abstract/document/4182409/","https://scholar.google.com/scholar?cites=14440537585681281230&as_sdt=5,33&sciodt=0,33&hl=en&num=20",589,"2017-06-15","","","","",0,0,0,0,56
56,"JP Hwang, S Park, E Kim","A new weighted approach to imbalanced data classification problem via support vector machine with quadratic cost function",2011,"Expert Systems with Applications","Elsevier","http://www.sciencedirect.com/science/article/pii/S0957417411000819","https://scholar.google.com/scholar?cites=18038379957393099718&as_sdt=5,33&sciodt=0,33&hl=en&num=20",617,"2017-06-15","","","","",0,0,0,0,56
56,"R Noori, MA Abdoli, AA Ghasrodashti…","Prediction of municipal solid waste generation with combination of support vector machine and principal component analysis: a case study of Mashhad",2009,"Environmental …","Wiley Online Library","http://onlinelibrary.wiley.com/doi/10.1002/ep.10317/full","https://scholar.google.com/scholar?cites=8810655523641314529&as_sdt=5,33&sciodt=0,33&hl=en&num=20",634,"2017-06-15","","","","",0,0,0,0,56
56,"AMS Muniz, H Liu, KE Lyons, R Pahwa, W Liu…","Comparison among probabilistic neural network, support vector machine and logistic regression for evaluating the effect of subthalamic stimulation in Parkinson …",2010,"Journal of …","Elsevier","http://www.sciencedirect.com/science/article/pii/S0021929009005922","https://scholar.google.com/scholar?cites=14330734418095287673&as_sdt=5,33&sciodt=0,33&hl=en&num=20",644,"2017-06-15","","","","",0,0,0,0,56
56,"KC Lam, E Palaneeswaran, C Yu","A support vector machine model for contractor prequalification",2009,"Automation in Construction","Elsevier","http://www.sciencedirect.com/science/article/pii/S0926580508001520","https://scholar.google.com/scholar?cites=14110529350078888884&as_sdt=5,33&sciodt=0,33&hl=en&num=20",669,"2017-06-15","","","","",0,0,0,0,56
56,"O Kisi, M Cimen","Precipitation forecasting by using wavelet-support vector machine conjunction model",2012,"Engineering Applications of Artificial Intelligence","Elsevier","http://www.sciencedirect.com/science/article/pii/S0952197611002144","https://scholar.google.com/scholar?cites=9420378899283979947&as_sdt=5,33&sciodt=0,33&hl=en&num=20",691,"2017-06-15","","","","",0,0,0,0,56
56,"A Tsirigos, I Rigoutsos","A sensitive, support-vector-machine method for the detection of horizontal gene transfers in viral, archaeal and bacterial genomes",2005,"Nucleic acids research","Oxford Univ Press","http://nar.oxfordjournals.org/content/33/12/3699.short","https://scholar.google.com/scholar?cites=11901509599407608158&as_sdt=5,33&sciodt=0,33&hl=en&num=20",699,"2017-06-15","","","","",0,0,0,0,56
55,"Y Yuan, J Yan, C Xu","Polynomial smooth support vector machine(PSSVM).",2005,"Jisuanji Xuebao(Chin. J. Comput.)","","","https://scholar.google.com/scholar?cites=6941411946621865580&as_sdt=5,33&sciodt=0,33&hl=en&num=20",322,"2017-06-15","CITATION","","","",0,0,0,0,55
55,"HC Lian, BL Lu, E Takikawa, S Hosoi","Gender recognition using a min-max modular support vector machine",2005,"Advances in Natural Computation","Springer","http://www.springerlink.com/index/EFVW3DCM4DRTGMV2.pdf","https://scholar.google.com/scholar?cites=14524060003610542574&as_sdt=5,33&sciodt=0,33&hl=en&num=20",397,"2017-06-15","","","","",0,0,0,0,55
55,"H Shimodaira, K Noma, M Nakai, S Sagayama","Support vector machine with dynamic time-alignment kernel for speech recognition.",2001,"Interspeech","tsi.enst.fr","http://www.tsi.enst.fr/~chollet/Biblio/Congres/Audio/Eurospeech01/CDROM/papers/page1841.pdf","https://scholar.google.com/scholar?cites=8908067948383791978&as_sdt=5,33&sciodt=0,33&hl=en&num=20",502,"2017-06-15","PDF","","","",0,0,0,0,55
55,"KS Park, BH Cho, DH Lee, SH Song…","Hierarchical support vector machine based heartbeat classification using higher order statistics and hermite basis function",2008,"… in Cardiology, 2008","ieeexplore.ieee.org","http://ieeexplore.ieee.org/abstract/document/4749019/","https://scholar.google.com/scholar?cites=5785180394391491977&as_sdt=5,33&sciodt=0,33&hl=en&num=20",553,"2017-06-15","","","","",0,0,0,0,55
55,"Q Yao, Z Guan, Y Zhou, J Tang, Y Hu…","Application of support vector machine for detecting rice diseases using shape and color texture features",2009,"… , 2009. ICEC'09. …","ieeexplore.ieee.org","http://ieeexplore.ieee.org/abstract/document/5167096/","https://scholar.google.com/scholar?cites=7618064585750881483&as_sdt=5,33&sciodt=0,33&hl=en&num=20",590,"2017-06-15","","","","",0,0,0,0,55
55,"ZD Zhong, XJ Zhu, GY Cao","Modeling a PEMFC by a support vector machine",2006,"Journal of Power Sources","Elsevier","http://www.sciencedirect.com/science/article/pii/S0378775306000966","https://scholar.google.com/scholar?cites=3048670670222247241&as_sdt=5,33&sciodt=0,33&hl=en&num=20",607,"2017-06-15","","","","",0,0,0,0,55
55,"LB Tang, LX Tang, HY Sheng","Forecasting volatility based on wavelet support vector machine",2009,"Expert Systems with Applications","Elsevier","http://www.sciencedirect.com/science/article/pii/S0957417408000511","https://scholar.google.com/scholar?cites=3346066062220171217&as_sdt=5,33&sciodt=0,33&hl=en&num=20",632,"2017-06-15","","","","",0,0,0,0,55
55,"K Woodsend, J Gondzio","Hybrid MPI/OpenMP parallel linear support vector machine training",2009,"Journal of Machine Learning Research","jmlr.org","http://www.jmlr.org/papers/v10/woodsend09a.html","https://scholar.google.com/scholar?cites=1463883743789858635&as_sdt=5,33&sciodt=0,33&hl=en&num=20",642,"2017-06-15","","","","",0,0,0,0,55
55,"MAH Farquad, I Bose","Preprocessing unbalanced data using support vector machine",2012,"Decision Support Systems","Elsevier","http://www.sciencedirect.com/science/article/pii/S0167923612000425","https://scholar.google.com/scholar?cites=18074721929709759193&as_sdt=5,33&sciodt=0,33&hl=en&num=20",645,"2017-06-15","","","","",0,0,0,0,55
55,"N Li, Z Sun, F Jiang","Prediction of protein-protein binding site by using core interface residue and support vector machine",2008,"BMC bioinformatics","bmcbioinformatics.biomedcentral. …","https://bmcbioinformatics.biomedcentral.com/articles/10.1186/1471-2105-9-553","https://scholar.google.com/scholar?cites=10513779843002037321&as_sdt=5,33&sciodt=0,33&hl=en&num=20",800,"2017-06-15","HTML","","","",0,0,0,0,55
55,"R Yu, M Abdel-Aty","Utilizing support vector machine in real-time crash risk evaluation",2013,"Accident Analysis & Prevention","Elsevier","http://www.sciencedirect.com/science/article/pii/S0001457512004186","https://scholar.google.com/scholar?cites=8790824483101472957&as_sdt=5,33&sciodt=0,33&hl=en&num=20",801,"2017-06-15","","","","",0,0,0,0,55
55,"A Al-Anazi, ID Gates","A support vector machine algorithm to classify lithofacies and model permeability in heterogeneous reservoirs",2010,"Engineering Geology","Elsevier","http://www.sciencedirect.com/science/article/pii/S0013795210000797","https://scholar.google.com/scholar?cites=7852352332320403613&as_sdt=5,33&sciodt=0,33&hl=en&num=20",808,"2017-06-15","","","","",0,0,0,0,55
55,"A Fayazi, M Arabloo, A Shokrollahi…","State-of-the-art least square support vector machine application for accurate determination of natural gas viscosity",2013,"Industrial & …","ACS Publications","http://pubs.acs.org/doi/abs/10.1021/ie402829p","https://scholar.google.com/scholar?cites=11831903029260695252&as_sdt=5,33&sciodt=0,33&hl=en&num=20",976,"2017-06-15","","","","",0,0,0,0,55
54,"WC Hong","A hybrid support vector machine regression for exchange rate prediction",2006,"","papers.ssrn.com","https://papers.ssrn.com/sol3/papers.cfm?abstract_id=874889","https://scholar.google.com/scholar?cites=18417894432527432580&as_sdt=5,33&sciodt=0,33&hl=en&num=20",423,"2017-06-15","","","","",0,0,0,0,54
54,"X Guo, Z Yuan, B Tian","Supplier selection based on hierarchical potential support vector machine",2009,"Expert Systems with Applications","Elsevier","http://www.sciencedirect.com/science/article/pii/S0957417408006088","https://scholar.google.com/scholar?cites=3068866203179181500&as_sdt=5,33&sciodt=0,33&hl=en&num=20",650,"2017-06-15","","","","",0,0,0,0,54
54,"G Wang, J Ma","A hybrid ensemble approach for enterprise credit risk assessment based on Support Vector Machine",2012,"Expert Systems with Applications","Elsevier","http://www.sciencedirect.com/science/article/pii/S0957417411015338","https://scholar.google.com/scholar?cites=5174064684436505847&as_sdt=5,33&sciodt=0,33&hl=en&num=20",685,"2017-06-15","","","","",0,0,0,0,54
54,"CYYXG Xuehao","… 610071); A NEW METHOD FOR NON-LINEAR CLASSIFY AND NON-LINEAR REGRESSION Ⅰ: INTRODUCTION TO SUPPORT VECTOR MACHINE [J]",2004,"Quarterly Journal of Applied Meteorology","","","https://scholar.google.com/scholar?cites=11545803212804290084&as_sdt=5,33&sciodt=0,33&hl=en&num=20",750,"2017-06-15","CITATION","","","",0,0,0,0,54
54,"S Siuly, Y Li","Improving the separability of motor imagery EEG signals using a cross correlation-based least square support vector machine for brain–computer interface",2012,"IEEE Transactions on Neural Systems and …","ieeexplore.ieee.org","http://ieeexplore.ieee.org/abstract/document/6138325/","https://scholar.google.com/scholar?cites=4472558187239943712&as_sdt=5,33&sciodt=0,33&hl=en&num=20",819,"2017-06-15","","","","",0,0,0,0,54
53,"Y Xiaofang, W Yaonan","Parameter selection of support vector machine for function approximation based on chaos optimization",2008,"Journal of Systems Engineering and Electronics","Elsevier","http://www.sciencedirect.com/science/article/pii/S1004413208600663","https://scholar.google.com/scholar?cites=13219415773839732416&as_sdt=5,33&sciodt=0,33&hl=en&num=20",612,"2017-06-15","","","","",0,0,0,0,53
53,"E Comak, K Polat, S Güneş, A Arslan","A new medical decision making system: least square support vector machine (LSSVM) with fuzzy weighting pre-processing",2007,"Expert Systems with Applications","Elsevier","http://www.sciencedirect.com/science/article/pii/S0957417405003507","https://scholar.google.com/scholar?cites=18037939129040113957&as_sdt=5,33&sciodt=0,33&hl=en&num=20",613,"2017-06-15","","","","",0,0,0,0,53
53,"S Ruan, S Lebonvallet, A Merabet…","Tumor segmentation from a multispectral MRI images by using support vector machine classification",2007,"… Imaging: From Nano …","ieeexplore.ieee.org","http://ieeexplore.ieee.org/abstract/document/4193516/","https://scholar.google.com/scholar?cites=6805306554988059703&as_sdt=5,33&sciodt=0,33&hl=en&num=20",614,"2017-06-15","","","","",0,0,0,0,53
53,"X Hu, Q Li","Using support vector machine to predict β‐and γ‐turns in proteins",2008,"Journal of computational chemistry","Wiley Online Library","http://onlinelibrary.wiley.com/doi/10.1002/jcc.20929/full","https://scholar.google.com/scholar?cites=7094831693153987596&as_sdt=5,33&sciodt=0,33&hl=en&num=20",674,"2017-06-15","","","","",0,0,0,0,53
53,"MC Arbelaez, F Versaci, G Vestri, P Barboni, G Savini","Use of a support vector machine for keratoconus and subclinical keratoconus detection by topographic and tomographic data",2012,"Ophthalmology","Elsevier","http://www.sciencedirect.com/science/article/pii/S0161642012005131","https://scholar.google.com/scholar?cites=5495018767052498476&as_sdt=5,33&sciodt=0,33&hl=en&num=20",678,"2017-06-15","","","","",0,0,0,0,53
53,"XY Wang, HY Yang, ZK Fu","A new wavelet-based image denoising using undecimated discrete wavelet transform and least squares support vector machine",2010,"Expert Systems with Applications","Elsevier","http://www.sciencedirect.com/science/article/pii/S0957417410001958","https://scholar.google.com/scholar?cites=16658279561941031502&as_sdt=5,33&sciodt=0,33&hl=en&num=20",688,"2017-06-15","","","","",0,0,0,0,53
53,"S Dutta, A Chatterjee, S Munshi","Correlation technique and least square support vector machine combine for frequency domain based ECG beat classification",2010,"Medical engineering & physics","Elsevier","http://www.sciencedirect.com/science/article/pii/S1350453310001761","https://scholar.google.com/scholar?cites=16352263255385379096&as_sdt=5,33&sciodt=0,33&hl=en&num=20",703,"2017-06-15","","","","",0,0,0,0,53
53,"YH Shao, Z Wang, WJ Chen, NY Deng","A regularization for the projection twin support vector machine",2013,"Knowledge-Based Systems","Elsevier","http://www.sciencedirect.com/science/article/pii/S0950705112002134","https://scholar.google.com/scholar?cites=4390956093770070992&as_sdt=5,33&sciodt=0,33&hl=en&num=20",711,"2017-06-15","","","","",0,0,0,0,53
53,"L Dioşan, A Rogozan, JP Pecuchet","Improving classification performance of support vector machine by genetically optimising kernel shape and hyper-parameters",2012,"Applied Intelligence","Springer","http://www.springerlink.com/index/95557LX073256406.pdf","https://scholar.google.com/scholar?cites=15038162490087909045&as_sdt=5,33&sciodt=0,33&hl=en&num=20",715,"2017-06-15","","","","",0,0,0,0,53
