Cites,Authors,Title,Year,Source,Publisher,ArticleURL,CitesURL,GSRank,QueryDate,Type,DOI,ISSN,CitationURL,Volume,Issue,StartPage,EndPage,ECC
177,"L Wang, J Zhu, H Zou","The doubly regularized support vector machine",2006,"Statistica Sinica","JSTOR","http://www.jstor.org/stable/24307560","https://scholar.google.com/scholar?cites=16019546042899521752&as_sdt=5,33&sciodt=0,33&hl=en&num=20",140,"2017-06-15","","","","",0,0,0,0,177
177,"D Niu, Y Wang, DD Wu","Power load forecasting using support vector machine and ant colony optimization",2010,"Expert Systems with Applications","Elsevier","http://www.sciencedirect.com/science/article/pii/S0957417409007799","https://scholar.google.com/scholar?cites=13422993784080303810&as_sdt=5,33&sciodt=0,33&hl=en&num=20",144,"2017-06-15","","","","",0,0,0,0,177
176,"C Yang, M Dong, J Hua","Region-based image annotation using asymmetrical support vector machine-based multiple-instance learning",2006,"Computer Vision and Pattern …","ieeexplore.ieee.org","http://ieeexplore.ieee.org/abstract/document/1641005/","https://scholar.google.com/scholar?cites=9447046082822894769&as_sdt=5,33&sciodt=0,33&hl=en&num=20",116,"2017-06-15","","","","",0,0,0,0,176
176,"Y Li, S Gong, J Sherrah, H Liddell","Support vector machine based multi-view face detection and recognition",2004,"Image and Vision Computing","Elsevier","http://www.sciencedirect.com/science/article/pii/S0262885603002610","https://scholar.google.com/scholar?cites=10293502455523353126&as_sdt=5,33&sciodt=0,33&hl=en&num=20",146,"2017-06-15","","","","",0,0,0,0,176
176,"Y Xue, ZR Li, CW Yap, LZ Sun, X Chen…","Effect of molecular descriptor feature selection in support vector machine classification of pharmacokinetic and toxicological properties of chemical agents",2004,"Journal of chemical …","ACS Publications","http://pubs.acs.org/doi/abs/10.1021/ci049869h","https://scholar.google.com/scholar?cites=6221551234329220192&as_sdt=5,33&sciodt=0,33&hl=en&num=20",190,"2017-06-15","","","","",0,0,0,0,176
176,"YD Cai, XJ Liu, X Xu, GP Zhou","Support vector machines for predicting protein structural class",2001,"BMC …","bmcbioinformatics.biomedcentral. …","https://bmcbioinformatics.biomedcentral.com/articles/10.1186/1471-2105-2-3","https://scholar.google.com/scholar?cites=10007014690623732772&as_sdt=5,33&sciodt=0,33&hl=en&num=20",353,"2017-06-15","HTML","","","",0,0,0,0,176
175,"Q Song, W Hu, W Xie","Robust support vector machine with bullet hole image classification",2002,"… on Systems, Man, and Cybernetics, Part …","ieeexplore.ieee.org","http://ieeexplore.ieee.org/abstract/document/1176893/","https://scholar.google.com/scholar?cites=16809506536443874219&as_sdt=5,33&sciodt=0,33&hl=en&num=20",97,"2017-06-15","","","","",0,0,0,0,175
175,"A Widodo, EY Kim, JD Son, BS Yang, ACC Tan…","Fault diagnosis of low speed bearing based on relevance vector machine and support vector machine",2009,"Expert Systems with …","Elsevier","http://www.sciencedirect.com/science/article/pii/S0957417408006611","https://scholar.google.com/scholar?cites=1718100688404137846&as_sdt=5,33&sciodt=0,33&hl=en&num=20",122,"2017-06-15","","","","",0,0,0,0,175
174,"PK Dash, SR Samantaray…","Fault classification and section identification of an advanced series-compensated transmission line using support vector machine",2007,"IEEE transactions on …","ieeexplore.ieee.org","http://ieeexplore.ieee.org/abstract/document/4039417/","https://scholar.google.com/scholar?cites=5815016267455950798&as_sdt=5,33&sciodt=0,33&hl=en&num=20",106,"2017-06-15","","","","",0,0,0,0,174
169,"OL Mangasarian, DR Musicant","Active support vector machine classification",2001,"Advances in neural information …","papers.nips.cc","http://papers.nips.cc/paper/1924-active-support-vector-machine-classification.pdf","https://scholar.google.com/scholar?cites=7473404517731993848&as_sdt=5,33&sciodt=0,33&hl=en&num=20",89,"2017-06-15","PDF","","","",0,0,0,0,169
168,"C Chen, X Zhou, Y Tian, X Zou, P Cai","Predicting protein structural class with pseudo-amino acid composition and support vector machine fusion network",2006,"Analytical biochemistry","Elsevier","http://www.sciencedirect.com/science/article/pii/S0003269706005318","https://scholar.google.com/scholar?cites=10637080080243806229&as_sdt=5,33&sciodt=0,33&hl=en&num=20",108,"2017-06-15","","","","",0,0,0,0,168
167,"S Chen, AK Samingan, L Hanzo","Support vector machine multiuser receiver for DS-CDMA signals in multipath channels",2001,"IEEE Transactions on Neural …","ieeexplore.ieee.org","http://ieeexplore.ieee.org/abstract/document/925563/","https://scholar.google.com/scholar?cites=13191350727456681357&as_sdt=5,33&sciodt=0,33&hl=en&num=20",111,"2017-06-15","","","","",0,0,0,0,167
167,"Z Lao, D Shen, D Liu, AF Jawad, ER Melhem…","Computer-assisted segmentation of white matter lesions in 3D MR images using support vector machine",2008,"Academic radiology","Elsevier","http://www.sciencedirect.com/science/article/pii/S1076633207005831","https://scholar.google.com/scholar?cites=2134227489356142729&as_sdt=5,33&sciodt=0,33&hl=en&num=20",152,"2017-06-15","","","","",0,0,0,0,167
166,"L Jiao, L Bo, L Wang","Fast sparse approximation for least squares support vector machine",2007,"IEEE Transactions on Neural Networks","ieeexplore.ieee.org","http://ieeexplore.ieee.org/abstract/document/4182386/","https://scholar.google.com/scholar?cites=14057989676786878235&as_sdt=5,33&sciodt=0,33&hl=en&num=20",134,"2017-06-15","","","","",0,0,0,0,166
166,"BM Asl, SK Setarehdan, M Mohebbi","Support vector machine-based arrhythmia classification using reduced features of heart rate variability signal",2008,"Artificial intelligence in medicine","Elsevier","http://www.sciencedirect.com/science/article/pii/S0933365708000559","https://scholar.google.com/scholar?cites=7257312801691576268&as_sdt=5,33&sciodt=0,33&hl=en&num=20",149,"2017-06-15","","","","",0,0,0,0,166
165,"M Helen, T Virtanen","Separation of drums from polyphonic music using non-negative matrix factorization and support vector machine",2005,"Signal Processing Conference, 2005 …","ieeexplore.ieee.org","http://ieeexplore.ieee.org/abstract/document/7078147/","https://scholar.google.com/scholar?cites=3702983931108394074&as_sdt=5,33&sciodt=0,33&hl=en&num=20",112,"2017-06-15","","","","",0,0,0,0,165
163,"F Rossi, N Villa","Support vector machine for functional data classification",2006,"Neurocomputing","Elsevier","http://www.sciencedirect.com/science/article/pii/S0925231205003309","https://scholar.google.com/scholar?cites=9824885066903071079&as_sdt=5,33&sciodt=0,33&hl=en&num=20",186,"2017-06-15","","","","",0,0,0,0,163
161,"Y LI, T FANG, E YU","Study of support vector machines for short-term load forecasting [J]",2003,"Proceedings of the Csee","en.cnki.com.cn","http://en.cnki.com.cn/Article_en/CJFDTOTAL-ZGDC200306010.htm","https://scholar.google.com/scholar?cites=8242916552277953034&as_sdt=5,33&sciodt=0,33&hl=en&num=20",344,"2017-06-15","","","","",0,0,0,0,161
160,"M Ge, R Du, G Zhang, Y Xu","Fault diagnosis using support vector machine with an application in sheet metal stamping operations",2004,"Mechanical Systems and Signal Processing","Elsevier","http://www.sciencedirect.com/science/article/pii/S0888327003000712","https://scholar.google.com/scholar?cites=12200768673165115173&as_sdt=5,33&sciodt=0,33&hl=en&num=20",124,"2017-06-15","","","","",0,0,0,0,160
160,"C Xu, F Dai, X Xu, YH Lee","GIS-based support vector machine modeling of earthquake-triggered landslide susceptibility in the Jianjiang River watershed, China",2012,"Geomorphology","Elsevier","http://www.sciencedirect.com/science/article/pii/S0169555X11006556","https://scholar.google.com/scholar?cites=15313742504374135059&as_sdt=5,33&sciodt=0,33&hl=en&num=20",174,"2017-06-15","","","","",0,0,0,0,160
159,"YJ Lee, WF Hsieh, CM Huang","/spl epsi/-SSVR: a smooth support vector machine for/spl epsi/-insensitive regression",2005,"IEEE Transactions on …","ieeexplore.ieee.org","http://ieeexplore.ieee.org/abstract/document/1411746/","https://scholar.google.com/scholar?cites=597302155266213507&as_sdt=5,33&sciodt=0,33&hl=en&num=20",128,"2017-06-15","","","","",0,0,0,0,159
156,"JDM Rennie, R Rifkin","Improving multiclass text classification with the support vector machine",2001,"","dspace.mit.edu","https://dspace.mit.edu/handle/1721.1/7241","https://scholar.google.com/scholar?cites=2007120663630931583&as_sdt=5,33&sciodt=0,33&hl=en&num=20",125,"2017-06-15","","","","",0,0,0,0,156
156,"K Yamano, K Tanaka, M Hirayama…","Self-localization of mobile robots with RFID system by using support vector machine",2004,"… Robots and Systems …","ieeexplore.ieee.org","http://ieeexplore.ieee.org/abstract/document/1389999/","https://scholar.google.com/scholar?cites=943888699634393501&as_sdt=5,33&sciodt=0,33&hl=en&num=20",126,"2017-06-15","","","","",0,0,0,0,156
156,"Q Li, Q Meng, J Cai, H Yoshino, A Mochida","Applying support vector machine to predict hourly cooling load in the building",2009,"Applied Energy","Elsevier","http://www.sciencedirect.com/science/article/pii/S0306261908003176","https://scholar.google.com/scholar?cites=7619394274294713021&as_sdt=5,33&sciodt=0,33&hl=en&num=20",153,"2017-06-15","","","","",0,0,0,0,156
155,"JTY Kwok","Automated text categorization using support vector machine",1998,"In Proceedings of the International Conference on …","Citeseer","http://citeseerx.ist.psu.edu/viewdoc/summary?doi=10.1.1.33.4931","https://scholar.google.com/scholar?cites=5475940634053983021&as_sdt=5,33&sciodt=0,33&hl=en&num=20",71,"2017-06-15","","","","",0,0,0,0,155
152,"A Anandhi, VV Srinivas, RS Nanjundiah…","Downscaling precipitation to river basin in India for IPCC SRES scenarios using support vector machine",2008,"International Journal …","Wiley Online Library","http://onlinelibrary.wiley.com/doi/10.1002/joc.1529/full","https://scholar.google.com/scholar?cites=1591760549592709123&as_sdt=5,33&sciodt=0,33&hl=en&num=20",136,"2017-06-15","HTML","","","",0,0,0,0,152
151,"CZ Cai, WL Wang, LZ Sun, YZ Chen","Protein function classification via support vector machine approach",2003,"Mathematical biosciences","Elsevier","http://www.sciencedirect.com/science/article/pii/S0025556403000968","https://scholar.google.com/scholar?cites=13454578896339370659&as_sdt=5,33&sciodt=0,33&hl=en&num=20",115,"2017-06-15","","","","",0,0,0,0,151
151,"JA Gualtieri, SR Chettri, RF Cromp…","Support vector machine classifiers as applied to AVIRIS data",1999,"Proc. Eighth JPL …","pdfs.semanticscholar.org","https://pdfs.semanticscholar.org/83e3/788925a7a78bcc89a4540c8808f8e2b7acb0.pdf","https://scholar.google.com/scholar?cites=9237504162765868009&as_sdt=5,33&sciodt=0,33&hl=en&num=20",137,"2017-06-15","PDF","","","",0,0,0,0,151
151,"Z Qi, Y Tian, Y Shi","Robust twin support vector machine for pattern classification",2013,"Pattern Recognition","Elsevier","http://www.sciencedirect.com/science/article/pii/S0031320312002890","https://scholar.google.com/scholar?cites=276359215805961375&as_sdt=5,33&sciodt=0,33&hl=en&num=20",173,"2017-06-15","","","","",0,0,0,0,151
150,"H Yang, L Chan, I King","Support vector machine regression for volatile stock market prediction",2002,"… Conference on Intelligent Data Engineering and …","Springer","http://link.springer.com/chapter/10.1007/3-540-45675-9_58","https://scholar.google.com/scholar?cites=14888258103949019682&as_sdt=5,33&sciodt=0,33&hl=en&num=20",110,"2017-06-15","","","","",0,0,0,0,150
149,"WZ Lu, WJ Wang","Potential assessment of the “support vector machine” method in forecasting ambient air pollutant trends",2005,"Chemosphere","Elsevier","http://www.sciencedirect.com/science/article/pii/S0045653504009889","https://scholar.google.com/scholar?cites=18200553704799316244&as_sdt=5,33&sciodt=0,33&hl=en&num=20",151,"2017-06-15","","","","",0,0,0,0,149
149,"J Luts, F Ojeda, R Van de Plas, B De Moor…","A tutorial on support vector machine-based methods for classification problems in chemometrics",2010,"Analytica Chimica …","Elsevier","http://www.sciencedirect.com/science/article/pii/S0003267010003132","https://scholar.google.com/scholar?cites=422764944303901940&as_sdt=5,33&sciodt=0,33&hl=en&num=20",205,"2017-06-15","","","","",0,0,0,0,149
149,"Y Shao, RS Lunetta","Comparison of support vector machine, neural network, and CART algorithms for the land-cover classification using limited training data points",2012,"ISPRS Journal of Photogrammetry and Remote …","Elsevier","http://www.sciencedirect.com/science/article/pii/S0924271612000664","https://scholar.google.com/scholar?cites=16186113621233345332&as_sdt=5,33&sciodt=0,33&hl=en&num=20",261,"2017-06-15","","","","",0,0,0,0,149
148,"MI Mandel, GE Poliner, DPW Ellis","Support vector machine active learning for music retrieval",2006,"Multimedia systems","Springer","http://www.springerlink.com/index/5027575W12851012.pdf","https://scholar.google.com/scholar?cites=8223244902170415274&as_sdt=5,33&sciodt=0,33&hl=en&num=20",150,"2017-06-15","","","","",0,0,0,0,148
147,"X Li, D Lord, Y Zhang, Y Xie","Predicting motor vehicle crashes using support vector machine models",2008,"Accident Analysis & Prevention","Elsevier","http://www.sciencedirect.com/science/article/pii/S0001457508000808","https://scholar.google.com/scholar?cites=8885991760167972347&as_sdt=5,33&sciodt=0,33&hl=en&num=20",196,"2017-06-15","","","","",0,0,0,0,147
146,"W Zhang, T Yoshida, X Tang","Text classification based on multi-word with support vector machine",2008,"Knowledge-Based Systems","Elsevier","http://www.sciencedirect.com/science/article/pii/S0950705108000968","https://scholar.google.com/scholar?cites=3692079188658051039&as_sdt=5,33&sciodt=0,33&hl=en&num=20",184,"2017-06-15","","","","",0,0,0,0,146
145,"S Fei, X Zhang","Fault diagnosis of power transformer based on support vector machine with genetic algorithm",2009,"Expert Systems with Applications","Elsevier","http://www.sciencedirect.com/science/article/pii/S0957417409002796","https://scholar.google.com/scholar?cites=16934399985353976031&as_sdt=5,33&sciodt=0,33&hl=en&num=20",145,"2017-06-15","","","","",0,0,0,0,145
143,"HL Chen, B Yang, J Liu, DY Liu","A support vector machine classifier with rough set-based feature selection for breast cancer diagnosis",2011,"Expert Systems with Applications","Elsevier","http://www.sciencedirect.com/science/article/pii/S0957417411001400","https://scholar.google.com/scholar?cites=11840409453383550830&as_sdt=5,33&sciodt=0,33&hl=en&num=20",182,"2017-06-15","","","","",0,0,0,0,143
143,"MPS Brown, WN Grundy, D Lin…","Support vector machine classification of microarray gene expression data",1999,"… of California, Santa …","noble.gs.washington.edu","https://noble.gs.washington.edu/papers/brown_knowledge_tr.pdf","https://scholar.google.com/scholar?cites=3238527171144018997&as_sdt=5,33&sciodt=0,33&hl=en&num=20",202,"2017-06-15","PDF","","","",0,0,0,0,143
142,"D Isa, LH Lee, VP Kallimani…","Text document preprocessing with the Bayes formula for classification using the support vector machine",2008,"IEEE Transactions on …","ieeexplore.ieee.org","http://ieeexplore.ieee.org/abstract/document/4492780/","https://scholar.google.com/scholar?cites=15570278379775162326&as_sdt=5,33&sciodt=0,33&hl=en&num=20",189,"2017-06-15","","","","",0,0,0,0,142
142,"P Christen","Automatic record linkage using seeded nearest neighbour and support vector machine classification",2008,"Proceedings of the 14th ACM SIGKDD international …","dl.acm.org","http://dl.acm.org/citation.cfm?id=1401913","https://scholar.google.com/scholar?cites=13139575190575149834&as_sdt=5,33&sciodt=0,33&hl=en&num=20",212,"2017-06-15","","","","",0,0,0,0,142
141,"S Li, H Wu, D Wan, J Zhu","An effective feature selection method for hyperspectral image classification based on genetic algorithm and support vector machine",2011,"Knowledge-Based Systems","Elsevier","http://www.sciencedirect.com/science/article/pii/S0950705110001097","https://scholar.google.com/scholar?cites=4516909379644353246&as_sdt=5,33&sciodt=0,33&hl=en&num=20",192,"2017-06-15","","","","",0,0,0,0,141
141,"SVN Vishwanathan, AJ Smola, MN Murty","SimpleSVM",2003,"… Conference on Machine …","dl.acm.org","http://dl.acm.org/citation.cfm?id=3041934","https://scholar.google.com/scholar?cites=3559441434014810199&as_sdt=5,33&sciodt=0,33&hl=en&num=20",246,"2017-06-15","","","","",0,0,0,0,141
140,"G Fung, OL Mangasarian","Incremental support vector machine classification",2002,"Proceedings of the 2002 SIAM International …","SIAM","http://epubs.siam.org/doi/abs/10.1137/1.9781611972726.15","https://scholar.google.com/scholar?cites=5788638466140069884&as_sdt=5,33&sciodt=0,33&hl=en&num=20",127,"2017-06-15","","","","",0,0,0,0,140
140,"G Dror, R Sorek, R Shamir","Accurate identification of alternatively spliced exons using support vector machine",2004,"Bioinformatics","academic.oup.com","https://academic.oup.com/bioinformatics/article-abstract/21/7/897/269014","https://scholar.google.com/scholar?cites=12574675250387657051&as_sdt=5,33&sciodt=0,33&hl=en&num=20",165,"2017-06-15","","","","",0,0,0,0,140
140,"JC Platt","Methods and apparatus for building a support vector machine classifier",2001,"US Patent 6,327,581","Google Patents","https://www.google.com/patents/US6327581","https://scholar.google.com/scholar?cites=5015448280168846876&as_sdt=5,33&sciodt=0,33&hl=en&num=20",259,"2017-06-15","","","","",0,0,0,0,140
139,"MH Song, J Lee, SP Cho, KJ Lee, SK Yoo","Support vector machine based arrhythmia classification using reduced features",2005,"International Journal of …","ijcas.com","http://www.ijcas.com/admin/paper/files/IJCAS_v3_n4_pp.571-579.pdf","https://scholar.google.com/scholar?cites=16642416375074831517&as_sdt=5,33&sciodt=0,33&hl=en&num=20",159,"2017-06-15","PDF","","","",0,0,0,0,139
139,"K Zhang, H Xu, J Tang, J Li","Keyword extraction using support vector machine",2006,"International Conference on Web-Age …","Springer","http://link.springer.com/10.1007%2F11775300_8","https://scholar.google.com/scholar?cites=18008973832100036641&as_sdt=5,33&sciodt=0,33&hl=en&num=20",166,"2017-06-15","","","","",0,0,0,0,139
138,"JAK Suykens, T Van Gestel…","A support vector machine formulation to PCA analysis and its kernel version",2003,"… on neural networks","ieeexplore.ieee.org","http://ieeexplore.ieee.org/abstract/document/1189643/","https://scholar.google.com/scholar?cites=6865415592451367966&as_sdt=5,33&sciodt=0,33&hl=en&num=20",129,"2017-06-15","","","","",0,0,0,0,138
138,"S Bauer, LP Nolte, M Reyes","Fully automatic segmentation of brain tumor images using support vector machine classification in combination with hierarchical conditional random field …",2011,"… on Medical Image Computing and Computer …","Springer","http://link.springer.com/chapter/10.1007/978-3-642-23626-6_44","https://scholar.google.com/scholar?cites=10210793864428829901&as_sdt=5,33&sciodt=0,33&hl=en&num=20",167,"2017-06-15","","","","",0,0,0,0,138
138,"S Chandaka, A Chatterjee, S Munshi","Cross-correlation aided support vector machine classifier for classification of EEG signals",2009,"Expert Systems with Applications","Elsevier","http://www.sciencedirect.com/science/article/pii/S0957417407005696","https://scholar.google.com/scholar?cites=11886009497250945069&as_sdt=5,33&sciodt=0,33&hl=en&num=20",177,"2017-06-15","","","","",0,0,0,0,138
137,"R Salat, S Osowski","Accurate fault location in the power transmission line using support vector machine approach",2004,"IEEE Transactions on power systems","ieeexplore.ieee.org","http://ieeexplore.ieee.org/abstract/document/1295008/","https://scholar.google.com/scholar?cites=8898394152210114089&as_sdt=5,33&sciodt=0,33&hl=en&num=20",158,"2017-06-15","","","","",0,0,0,0,137
137,"MC Lee","Using support vector machine with a hybrid feature selection method to the stock trend prediction",2009,"Expert Systems with Applications","Elsevier","http://www.sciencedirect.com/science/article/pii/S0957417409001560","https://scholar.google.com/scholar?cites=13258780820875993911&as_sdt=5,33&sciodt=0,33&hl=en&num=20",191,"2017-06-15","","","","",0,0,0,0,137
137,"F Yang, K Ichii, MA White, H Hashimoto…","Developing a continental-scale measure of gross primary production by combining MODIS and AmeriFlux data through Support Vector Machine approach",2007,"Remote Sensing of …","Elsevier","http://www.sciencedirect.com/science/article/pii/S0034425707000831","https://scholar.google.com/scholar?cites=17748718453817943748&as_sdt=5,33&sciodt=0,33&hl=en&num=20",254,"2017-06-15","","","","",0,0,0,0,137
136,"I Aydin, M Karakose, E Akin","A multi-objective artificial immune algorithm for parameter optimization in support vector machine",2011,"Applied Soft Computing","Elsevier","http://www.sciencedirect.com/science/article/pii/S1568494609002166","https://scholar.google.com/scholar?cites=10502191047246668472&as_sdt=5,33&sciodt=0,33&hl=en&num=20",172,"2017-06-15","","","","",0,0,0,0,136
136,"Y Liu","Active learning with support vector machine applied to gene expression data for cancer classification",2004,"Journal of chemical information and computer sciences","ACS Publications","http://pubs.acs.org/doi/abs/10.1021/ci049810a","https://scholar.google.com/scholar?cites=1323305839161250042&as_sdt=5,33&sciodt=0,33&hl=en&num=20",175,"2017-06-15","","","","",0,0,0,0,136
136,"Y Tan, J Wang","A support vector machine with a hybrid kernel and minimal Vapnik-Chervonenkis dimension",2004,"IEEE Transactions on knowledge and data …","ieeexplore.ieee.org","http://ieeexplore.ieee.org/abstract/document/1269664/","https://scholar.google.com/scholar?cites=622802420648349182&as_sdt=5,33&sciodt=0,33&hl=en&num=20",198,"2017-06-15","","","","",0,0,0,0,136
136,"RM Balabin, EI Lomakina","Support vector machine regression (SVR/LS-SVM)—an alternative to neural networks (ANN) for analytical chemistry? Comparison of nonlinear methods on near …",2011,"Analyst","pubs.rsc.org","http://pubs.rsc.org/en/content/articlehtml/2011/an/c0an00387e","https://scholar.google.com/scholar?cites=16354422361541356047&as_sdt=5,33&sciodt=0,33&hl=en&num=20",214,"2017-06-15","","","","",0,0,0,0,136
136,"N Chen","Support vector machine in chemistry",2004,"","books.google.com","https://books.google.com/books?hl=en&lr=&id=gTVkDQAAQBAJ&oi=fnd&pg=PR5&dq=support+vector+machine&ots=Tgqca8dvwt&sig=1xZRqnCk6oR1Y7zA1p_JE6Ybp8Y","https://scholar.google.com/scholar?cites=17167893113990319771&as_sdt=5,33&sciodt=0,33&hl=en&num=20",304,"2017-06-15","BOOK","","","",0,0,0,0,136
135,"Q Li, Q Meng, J Cai, H Yoshino, A Mochida","Predicting hourly cooling load in the building: a comparison of support vector machine and different artificial neural networks",2009,"Energy Conversion and …","Elsevier","http://www.sciencedirect.com/science/article/pii/S0196890408003154","https://scholar.google.com/scholar?cites=5913224363134309521&as_sdt=5,33&sciodt=0,33&hl=en&num=20",179,"2017-06-15","","","","",0,0,0,0,135
135,"H Hernault, H Prendinger…","HILDA: A discourse parser using support vector machine classification",2010,"Dialogue & …","journals.linguisticsociety.org","http://journals.linguisticsociety.org/elanguage/dad/article/download/591/591-2300-1-PB.pdf","https://scholar.google.com/scholar?cites=15091869514756202595&as_sdt=5,33&sciodt=0,33&hl=en&num=20",201,"2017-06-15","PDF","","","",0,0,0,0,135
134,"PGV Axelberg, IYH Gu…","Support vector machine for classification of voltage disturbances",2007,"IEEE Transactions on …","ieeexplore.ieee.org","http://ieeexplore.ieee.org/abstract/document/4265649/","https://scholar.google.com/scholar?cites=4862980214766593325&as_sdt=5,33&sciodt=0,33&hl=en&num=20",162,"2017-06-15","","","","",0,0,0,0,134
134,"RC Chen, CH Hsieh","Web page classification based on a support vector machine using a weighted vote schema",2006,"Expert Systems with Applications","Elsevier","http://www.sciencedirect.com/science/article/pii/S0957417405002307","https://scholar.google.com/scholar?cites=72468789827989238&as_sdt=5,33&sciodt=0,33&hl=en&num=20",168,"2017-06-15","","","","",0,0,0,0,134
134,"O Kisi, M Cimen","A wavelet-support vector machine conjunction model for monthly streamflow forecasting",2011,"Journal of Hydrology","Elsevier","http://www.sciencedirect.com/science/article/pii/S002216941000819X","https://scholar.google.com/scholar?cites=15698301267568650522&as_sdt=5,33&sciodt=0,33&hl=en&num=20",181,"2017-06-15","","","","",0,0,0,0,134
134,"FR Gomez, AD Rajapakse…","Support vector machine-based algorithm for post-fault transient stability status prediction using synchronized measurements",2011,"… on Power Systems","ieeexplore.ieee.org","http://ieeexplore.ieee.org/abstract/document/5617329/","https://scholar.google.com/scholar?cites=13035781504044932578&as_sdt=5,33&sciodt=0,33&hl=en&num=20",213,"2017-06-15","","","","",0,0,0,0,134
133,"Y Chen, G Wang, S Dong","Learning with progressive transductive support vector machine",2003,"Pattern Recognition Letters","Elsevier","http://www.sciencedirect.com/science/article/pii/S0167865503000084","https://scholar.google.com/scholar?cites=1016294252824575311&as_sdt=5,33&sciodt=0,33&hl=en&num=20",160,"2017-06-15","","","","",0,0,0,0,133
132,"CS Shin, KI Kim, MH Park…","Support vector machine-based text detection in digital video",2000,"Neural networks for signal …","ieeexplore.ieee.org","http://ieeexplore.ieee.org/abstract/document/890142/","https://scholar.google.com/scholar?cites=4959321425814065062&as_sdt=5,33&sciodt=0,33&hl=en&num=20",119,"2017-06-15","","","","",0,0,0,0,132
132,"R Debnath, N Takahide, H Takahashi","A decision based one-against-one method for multi-class support vector machine",2004,"Pattern Analysis and Applications","Springer","http://link.springer.com/article/10.1007/s10044-004-0213-6","https://scholar.google.com/scholar?cites=10147587419357426831&as_sdt=5,33&sciodt=0,33&hl=en&num=20",207,"2017-06-15","","","","",0,0,0,0,132
